,Unnamed: 0,url,title,text,author,date,clean_text
40,40,https://edition.cnn.com/2023/02/26/football/manchester-united-newcastle-united-carabao-cup-final-spt-intl,Manchester United wins first trophy since 2017 with victory over Newcastle United in Carabao Cup final,"(CNN) Manchester United won its first trophy since 2017 with a 2-0 victory over Newcastle United to win the Carabao Cup at Wembley Stadium on Sunday.

Casemiro broke the deadlock minutes after the half-hour mark, heading home from a Luke Shaw freekick.

Five minutes later, the lead was doubled after Marcus Rashford looked to have continued his electric form when his deflected strike just evaded Lorius Karius to fly into the Newcastle goal despite the German's despairing fingertips -- it was later ruled to be a Sven Botman own goal.

The trophy cements an excellent turnaround under Manchester United manager Erik ten Hag who has transformed the club from perennial underachievers to trophy winners in just over 10 months.

""It's an amazing feeling, we've been searching for this moment, us, the fans, the club, finally we get our trophy, we deserve it,"" Manchester United midfielder Bruno Fernandes told Sky Sports just moments after the final whistle.

""It's been an amazing period. The first trophy of the season but we want more. It's not enough for this club, we want more and we need more because our standards deserve more.""

Turnaround

It was a final longtime coming for both teams for different reasons.

For Manchester United, the club hasn't won a trophy since 2017; a cataclysmic expanse for the club the size of it.

In the black and white of Newcastle, it is an even longer wait, having not won any major silverware for 54 years.

The PIF -- which has an 80% stake in the club, as part of a three-party consortium -- is a sovereign wealth fund chaired by Mohammed bin Salman, the Crown Prince of Saudi Arabia, the man who a US intelligence report named responsible for approving the operation that led to the murder of journalist Jamal Khashoggi.

With thousands of fans having made the journey down to London from Newcastle for the final, Wembley's atmosphere had a proper cup final feel to it.

And to the delight of Manchester United fans, their local hero and the team's man in form, Rashford, was declared fit to start despite a recent injury scare. Newcastle was without its own star player in goalkeeper Nick Pope who had been shown a red card in his previous game meaning he was suspended.

In the opening few minutes, and in a crackling atmosphere, there was very little between the two teams, with Newcastle's Allan Saint-Maximin going closest after some trademark quick footwork.

When it looked as if Newcastle might be building up a head of steam, it was sucker punched when a free kick from out wide was headed past Karius by Casemiro.

Casemiro celebrates scoring Manchester United's first goal in the Carabao Cup final.

The Brazilian midfielder was signed by manager Ten Hag in a £60 million ($73m) deal from Real Madrid in the summer and his impact as the heart of the team has been indicative of Manchester United's rise since Ten Hag's arrival at the club.

Things went from bad to worse for Newcastle minutes later when some neat link up play between Rashford and Wout Weghorst saw the England star played into the opposition's box. Although he was able to get away a left-footed shot under pressure from Botman, Rashford's shot looked to have been heading wide meaning the goal was credited to the Netherlands defender.

After the halftime break, Newcastle ramped up its pressure on David de Gea's goal, with Saint-Maximin and the newly-introduced Alexander Isak doing their best to fashion goalscoring opportunities.

The final two minutes were filled with set pieces, substitutions and breakaway chances -- with Manchester United actually looking the most likely to score.

In the dying seconds, with the result seemingly wrapped up, Portugal international Fernandes had a glorious opportunity to cap off a memorable afternoon, only for Karius to produce a smart stop.

Rashford celebrates after Manchester United's second goal in the Carabao Cup final.

In the end, Manchester United was able to run down the remainder of the clock, end its six-year trophy wait -- the club's longest wait for a major trophy since 1983 -- and possibly usher in a new era at the club.

""It's a mixture of all the emotions. It's massive for us to be involved in these types of games. it's something we've missed as a club,"" Rashford told Sky Sports afterwards.

""The fact we've come all this way and won it, it's a massive feeling. Hopefully it pushes us now to keep going. There's hunger to add more finals like this. I've been in finals where we've won and lost. It's massive for us as a club and individuals and it's part of our history. We want to keep adding to that.""

He added: ""We want to be involved in a lot of games and that means we've got to stay in the competitions. If we want to win things, we have to keep pushing.""

For Newcastle, it was yet more disappointment at Wembley as it has now lost each of its last nine matches at the stadium, a run that began in the 1974 FA Cup final, extending what is the longest ever losing run by a club side at the venue.",['Ben Morse'],2023-02-26,"manchester united won its first trophy since 2017 with a 2-0 victory over newcastle united to win the carabao cup at wembley stadium on sunday.casemiro broke the deadlock minutes after the half-hour mark, heading home from a luke shaw freekick.five minutes later, the lead was doubled after marcus rashford looked to have continued his electric form when his deflected strike just evaded lorius karius to fly into the newcastle goal despite the german's despairing fingertips -- it was later ruled to be a sven botman own goal.the trophy cements an excellent turnaround under manchester united manager erik ten hag who has transformed the club from perennial underachievers to trophy winners in just over 10 months.""it's an amazing feeling, we've been searching for this moment, us, the fans, the club, finally we get our trophy, we deserve it,"" manchester united midfielder bruno fernandes told sky sports just moments after the final whistle.""it's been an amazing period. the first trophy of the season but we want more. it's not enough for this club, we want more and we need more because our standards deserve more.""turnaroundit was a final longtime coming for both teams for different reasons.for manchester united, the club hasn't won a trophy since 2017; a cataclysmic expanse for the club the size of it.in the black and white of newcastle, it is an even longer wait, having not won any major silverware for 54 years.the pif -- which has an 80% stake in the club, as part of a three-party consortium -- is a sovereign wealth fund chaired by mohammed bin salman, the crown prince of saudi arabia, the man who a us intelligence report named responsible for approving the operation that led to the murder of journalist jamal khashoggi.with thousands of fans having made the journey down to london from newcastle for the final, wembley's atmosphere had a proper cup final feel to it.and to the delight of manchester united fans, their local hero and the team's man in form, rashford, was declared fit to start despite a recent injury scare. newcastle was without its own star player in goalkeeper nick pope who had been shown a red card in his previous game meaning he was suspended.in the opening few minutes, and in a crackling atmosphere, there was very little between the two teams, with newcastle's allan saint-maximin going closest after some trademark quick footwork.when it looked as if newcastle might be building up a head of steam, it was sucker punched when a free kick from out wide was headed past karius by casemiro.casemiro celebrates scoring manchester united's first goal in the carabao cup final.the brazilian midfielder was signed by manager ten hag in a 60 million ($73m) deal from real madrid in the summer and his impact as the heart of the team has been indicative of manchester united's rise since ten hag's arrival at the club.things went from bad to worse for newcastle minutes later when some neat link up play between rashford and wout weghorst saw the england star played into the opposition's box. although he was able to get away a left-footed shot under pressure from botman, rashford's shot looked to have been heading wide meaning the goal was credited to the netherlands defender.after the halftime break, newcastle ramped up its pressure on david de gea's goal, with saint-maximin and the newly-introduced alexander isak doing their best to fashion goalscoring opportunities.the final two minutes were filled with set pieces, substitutions and breakaway chances -- with manchester united actually looking the most likely to score.in the dying seconds, with the result seemingly wrapped up, portugal international fernandes had a glorious opportunity to cap off a memorable afternoon, only for karius to produce a smart stop.rashford celebrates after manchester united's second goal in the carabao cup final.in the end, manchester united was able to run down the remainder of the clock, end its six-year trophy wait -- the club's longest wait for a major trophy since 1983 -- and possibly usher in a new era at the club.""it's a mixture of all the emotions. it's massive for us to be involved in these types of games. it's something we've missed as a club,"" rashford told sky sports afterwards.""the fact we've come all this way and won it, it's a massive feeling. hopefully it pushes us now to keep going. there's hunger to add more finals like this. i've been in finals where we've won and lost. it's massive for us as a club and individuals and it's part of our history. we want to keep adding to that.""he added: ""we want to be involved in a lot of games and that means we've got to stay in the competitions. if we want to win things, we have to keep pushing.""for newcastle, it was yet more disappointment at wembley as it has now lost each of its last nine matches at the stadium, a run that began in the 1974 fa cup final, extending what is the longest ever losing run by a club side at the venue."
43,43,https://edition.cnn.com/2023/02/26/sport/australia-south-africa-women-t20-world-cup-spt-intl,Australia wins sixth Women's T20 World Cup with victory over South Africa,"(CNN) Australia won the Women's T20 World Cup in brilliant fashion, defeating home side South Africa by 19 runs in front of a sold out Newlands Cricket Ground in Cape Town on Saturday

Victory once again underlined Australia's dominance in the sport, as the team completed a repeat three-peat under captain Meg Lanning and won the tournament for the sixth time in seven editions.

""It is a pretty special effort from the group,"" Lanning told Sky Sports afterwards.

""We felt we had a good score and felt confident if we could hit our areas. We set the tone in an excellent powerplay. We have a special group, not just the players but also the support staff.""

After Lanning won the toss and elected to bat first, the Australian openers, Alyssa Healy and Beth Mooney, navigated their way through the first few overs as the home crowd urged on the South African attack.

Read More",['Issy Ronald'],2023-02-26,"australia won the women's t20 world cup in brilliant fashion, defeating home side south africa by 19 runs in front of a sold out newlands cricket ground in cape town on saturdayvictory once again underlined australia's dominance in the sport, as the team completed a repeat three-peat under captain meg lanning and won the tournament for the sixth time in seven editions.""it is a pretty special effort from the group,"" lanning told sky sports afterwards.""we felt we had a good score and felt confident if we could hit our areas. we set the tone in an excellent powerplay. we have a special group, not just the players but also the support staff.""after lanning won the toss and elected to bat first, the australian openers, alyssa healy and beth mooney, navigated their way through the first few overs as the home crowd urged on the south african attack.read more"
45,45,https://edition.cnn.com/2023/02/27/football/besiktas-football-turkey-earthquake-spt-intl,"Turkish soccer fans throw stuffed animals on the field, vent dissatisfaction with government quake response","(CNN) In a show of support for children impacted by the earthquake in Turkey, soccer fans threw stuffed animals onto the pitch during a match between Beşiktaş and Antalyaspor on Sunday.

The game stopped at four minutes and 17 seconds to correspond with the time the earthquake struck southeastern Turkey -- 4:17 a.m. local time on February 6.

Fans showered the stadium with teddy bears and other stuffed toys of all colors and sizes during the match at Vodafone Park.

These will be sent by Beşiktaş to children impacted by the earthquake, which has killed about 50,000 people across Turkey and Syria.

Players rushed to collect the stuffed animals while the scoreboard screen flashed with the license plate numbers of the eleven Turkish provinces impacted by the earthquake.

Read More","['Hande Atay Alam', 'Isil Sariyuce']",2023-02-27,"in a show of support for children impacted by the earthquake in turkey, soccer fans threw stuffed animals onto the pitch during a match between beikta and antalyaspor on sunday.the game stopped at four minutes and 17 seconds to correspond with the time the earthquake struck southeastern turkey -- 4:17 a.m. local time on february 6.fans showered the stadium with teddy bears and other stuffed toys of all colors and sizes during the match at vodafone park.these will be sent by beikta to children impacted by the earthquake, which has killed about 50,000 people across turkey and syria.players rushed to collect the stuffed animals while the scoreboard screen flashed with the license plate numbers of the eleven turkish provinces impacted by the earthquake.read more"
46,46,https://edition.cnn.com/2023/02/15/sport/jonathan-gannon-eagles-arizona-cardinals-nfl-spt-intl,Arizona Cardinals hire Philadelphia Eagles defensive coordinator Jonathan Gannon as new head coach,"(CNN) The Arizona Cardinals have hired Philadelphia Eagles defensive coordinator Jonathan Gannon as their new head coach, just two days after the Eagles lost 38-35 to the Kansas City Chiefs in the Super Bowl.

The announcement came just hours after the Eagles' offensive coordinator Shane Steichen left his post to join the Indianapolis Colts as their head coach.

According to the Cardinals, Gannon signed a five-year deal.

""I am super excited about the opportunity,"" Gannon said. ""I look forward to getting my hands on the players and putting a winning product on the field.""

Gannon, 40, has 15 years of coaching experience, spending the last two seasons as the defensive coordinator of the Eagles which included the trip to Super Bowl LVII.

Read More","['David Close', 'Alasdair Howorth']",2023-02-15,"the arizona cardinals have hired philadelphia eagles defensive coordinator jonathan gannon as their new head coach, just two days after the eagles lost 38-35 to the kansas city chiefs in the super bowl.the announcement came just hours after the eagles' offensive coordinator shane steichen left his post to join the indianapolis colts as their head coach.according to the cardinals, gannon signed a five-year deal.""i am super excited about the opportunity,"" gannon said. ""i look forward to getting my hands on the players and putting a winning product on the field.""gannon, 40, has 15 years of coaching experience, spending the last two seasons as the defensive coordinator of the eagles which included the trip to super bowl lvii.read more"
51,51,https://edition.cnn.com/2023/02/20/golf/jon-rahm-tiger-woods-genesis-invitational-spt-intl,Tiger Woods produces best performance since car crash as Jon Rahm wins Genesis Invitational to regain world No. 1 spot,"(CNN) Tiger Woods played his best golf since the car crash in February 2021 that threatened to end his career to finish tied-45th at the Genesis Invitational, as Jon Rahm walked away with his third PGA Tour win of 2023 to regain the world No. 1 spot.

It was Woods' first competitive outing since The Open Championship in July 2022 and his first non-major appearance since October 2020.

The 15-time major winner has played sparingly since sustaining serious leg injuries in the crash in Southern California, but shot his lowest single round score -- 67 on Saturday -- since the crash en route to finishing one-under-par for the tournament.

Following his final round, Woods said his goal from now on is to play the four majors every year, but he doesn't expect ""to play too much more than that.""

""My body and my leg and my back just won't allow me to play much more than that anymore,"" he told CBS. ""So that was my goal last year and I was able to play three of the four, and this year, I can hopefully play all four. That is going to be my schedule going forward because of all of the limitations I have.

Read More",['Matias Grez'],2023-02-20,"tiger woods played his best golf since the car crash in february 2021 that threatened to end his career to finish tied-45th at the genesis invitational, as jon rahm walked away with his third pga tour win of 2023 to regain the world no. 1 spot.it was woods' first competitive outing since the open championship in july 2022 and his first non-major appearance since october 2020.the 15-time major winner has played sparingly since sustaining serious leg injuries in the crash in southern california, but shot his lowest single round score -- 67 on saturday -- since the crash en route to finishing one-under-par for the tournament.following his final round, woods said his goal from now on is to play the four majors every year, but he doesn't expect ""to play too much more than that.""""my body and my leg and my back just won't allow me to play much more than that anymore,"" he told cbs. ""so that was my goal last year and i was able to play three of the four, and this year, i can hopefully play all four. that is going to be my schedule going forward because of all of the limitations i have.read more"
