,Unnamed: 0,url,title,text,author,date,clean_text
92,92,https://edition.cnn.com/2023/03/07/sport/conor-benn-doping-analysis-reaction-spt-intl,Conor Benn has 'serious concerns' over boxing's drug testing after being cleared of failed test because of 'highly-elevated consumption of eggs',"(CNN) Conor Benn's scheduled fight with Chris Eubank Jr. last year was meant to be career defining for both men.

Except the fight never took place and now Benn says the fallout of its cancellation has raised serious questions about boxing's drugs testing protocols.

The two were scheduled to take to their ring almost exactly 30 years after their fathers had in two fights that gripped a generation of boxing fans. Benn and Eubank Jr. were fighting for more than just glory. This was a fight for family honor.

But on the eve of the bout, news of Benn failing a drugs test came to light. The bout was called off after Benn tested positive for clomiphene, a fertility drug used by women who struggle to ovulate.

Benn repeatedly denied any wrongdoing and in February 2023, the World Boxing Council (WBC) issued a statement clearing Benn of wrongdoing, stating that while his urine test indicated the presence of prohibited substances, his ""highly-elevated consumption of eggs"" prior to testing offered a ""reasonable explanation"" for his failed test.

Despite welcoming the news that he could return to the sport, the 26-year-old Benn has criticized the investigation and expressed his concerns about the transparency of the process, in particular leveling criticism at the WBC and the British Boxing Board of Control (BBBofC), the governing body for professional boxing in Great Britain.

In a statement posted on his Instagram story last week, Benn said that ""the manner in which I've been cleared has seemed to create further questions and add further fuel to baseless negative speculation.""

CNN has contacted the WBC and BBBofC for comment.

Cancellation

According to the U.S. Anti-Doping Agency (USADA), clomiphene in men can potentially boost testosterone levels ""by interfering with the negative feedback loop of the hypothalamic-pituitary-gonadal axis."" The drug is also included on the World Anti-Doping Agency's prohibited list under anti-estrogenic substances.

Benn began his statement on Instagram addressing the ruling saying that while he was ""grateful for the ultimate finding"" of being declared ""innocent of being a drugs cheat,"" he couldn't sit by without commenting on the whole investigation.

""It was the right decision and it was the only one I was willing to accept. The easy option would have been to accept a six month ban, save myself a huge legal bill and simply move on, by my reputation and my family name is worth more to me than that,"" he wrote.

""At no point did I indicate that I failed any VADA tests because of contaminated eggs,"" Benn wrote, referring to the Voluntary Anti-Doping Association (VADA), a third-party testing agency used by the fighters to ensure a clean bout and which carried out his test.

""As part of its lengthy investigation, the WBC instructed its own experts to review my supplements and diet, and they concluded that egg contamination was the most likely cause,"" he wrote, saying he provided a 270-page report to the body.

Benn added: ""However, I feel like the WBC statement did a disservice to my defence, which was based upon a comprehensive scientific review of the testing procedures which set out a number of reasons why we believed the results were completely unreliable and proved beyond any reasonable doubt that I am innocent.""

Benn is still under investigation from UK Anti-Doping (UKAD) and the BBCofC at the time of publication.

He criticized the BBCofC's handling of his case in his statement.

""As for the BBBoC, they attacked me publicly and privately during the most difficult time in my life, treating me with utter contempt and without any consideration for the fair process or my mental state.""

The BBCofC released their own statement on Twitter after the announcement from the WBC in February, saying that it was not ""party to the review"" and had not seen ""any evidence provided on Mr. Benn's behalf.""

It added that while ""it respects the WBC, the WBC is a sanctioning body and not a governing body. The BBCofC was the governing body with whom Mr. Benn was licensed at the material time, and as such any alleged anti-doping violation shall be dealt with in accordance with its rules and regulations.""

It pointed to the UK Anti-Doping Rules, brought in by UKAD, which the BBCofC adheres to and that as a result, ""the decision of the WBC does not affect the ongoing implantation of the BBCofC's rules (and those of UKAD).""

CNN has contacted the BBCofC for comment. UKAD declined to comment when given the opportunity.

Benn punches Chris Algieri during their WBA Continental welterweight title fight on December 11, 2021.

'Serious concerns'

The WBC's February ruling stated that they had found there to be ""no failures in the procedures"" in relation to Benn's sample and test.

But Benn said he thought there was a lack of transparency throughout the whole investigation, claiming that his sample tested negative three times, but ""without explanation"" was tested nine days later which resulted in the positive test.

According to Benn, he asked for his B sample from the drug test -- which the World Anti-Doping Agency says ""affords the athlete the opportunity to have second analysis performed in the event their A sample returns"" a positive test -- to be tested as soon as possible.

Benn also said in his statement that he has been advised to take his case to the Court of Arbitration for Sport.

Benn said that he had never previously tested positive for a banned substance before October's test, adding to his belief that the result was a ""testing error.""

While Benn now says that he had to concentrate on ""rebuilding"" his career, the process he has gone through has given him ""serious concerns about the whole testing system"" in boxing.

""Anti-doping protections are obviously extremely important, but so is ensuring people are given due proves and presumed innocent until proven guilty. Cheaters should be caught and punished, but people like me who prove their innocent should be vindicated and allowed to continue their career.""

Benn admitted that he'd had suicidal thoughts as a result of the whole process, saying: ""I didn't think I'd see another day.""

""It's hurt me,"" Benn said in an interview with Piers Morgan on TalkTV. ""I didn't think I was going to make it through this period. I didn't think I was going to make it through.""

When asked if he had felt suicidal, Benn replied: ""Yeah. Yeah, I'd say so -- and it upsets me now because I don't know how I got so bad. I got in a really bad way about it.

""I was shamed for something I hadn't even done. ... If I had done something wrong, I'm human. I'd raise my hands to it, 'I made a mistake,' whatever it is, I raise my hands. Never this.

""I felt seven years of hard work and sacrifice, and leaving my family and the image I maintain, was just ruined by somebody else's incompetence. It's been hard for the family.""

Background

At the time of Benn's positive test last year, the bout's promoter, Matchroom, and that organization's boss, Eddie Hearn, had been keen for the bout to go ahead despite it being ""prohibited"" by the BBBofC.

Hearn told the BBC at the time: ""As we stand right now, the BBBofC is not sanctioning the fight. That does not mean the fight is off, but there is a process we have to go through.

""Conor Benn is not suspended, he is free and clear to fight. There's lots going on with the lawyers.""

Eddie Hearn, boxing promoter of Matchroom boxing, speaks at the press conference ahead of Benn's scheduled fight with Eubank Jr.

Amid mounting public pressure and safety concerns, the fight was canceled.

The decision to overlook potential safety concerns and stage a bout including a fighter who had tested positive for a banned substance prompted criticism that boxing prioritizes the fight's money-making opportunities rather than the boxers' safety.

Weeks later, the BBBofC claimed that Benn voluntarily relinquished his license with the governing body just before allegations of misconduct against Benn were upheld.

Benn accused the BBBofC of conducting an ""unfair and biased procedure."" He also disputes that he relinquished his license.

""(Benn) strongly refutes the allegation of misconduct (which for the avoidance of doubt is not in relation to the Vada issue) and firmly believes that an independent tribunal will reach a wholly different conclusion,"" a statement said on Benn's Twitter at the time.

And a few months later, the WBC announced after it had conducted an investigation into the matter that Benn would be included in its ratings once again after it found that he had not ""engaged in intentional or knowing ingestion of clomiphene.""",['Ben Morse'],2023-03-07,"conor benn's scheduled fight with chris eubank jr. last year was meant to be career defining for both men.except the fight never took place and now benn says the fallout of its cancellation has raised serious questions about boxing's drugs testing protocols.the two were scheduled to take to their ring almost exactly 30 years after their fathers had in two fights that gripped a generation of boxing fans. benn and eubank jr. were fighting for more than just glory. this was a fight for family honor.but on the eve of the bout, news of benn failing a drugs test came to light. the bout was called off after benn tested positive for clomiphene, a fertility drug used by women who struggle to ovulate.benn repeatedly denied any wrongdoing and in february 2023, the world boxing council (wbc) issued a statement clearing benn of wrongdoing, stating that while his urine test indicated the presence of prohibited substances, his ""highly-elevated consumption of eggs"" prior to testing offered a ""reasonable explanation"" for his failed test.despite welcoming the news that he could return to the sport, the 26-year-old benn has criticized the investigation and expressed his concerns about the transparency of the process, in particular leveling criticism at the wbc and the british boxing board of control (bbbofc), the governing body for professional boxing in great britain.in a statement posted on his instagram story last week, benn said that ""the manner in which i've been cleared has seemed to create further questions and add further fuel to baseless negative speculation.""cnn has contacted the wbc and bbbofc for comment.cancellationaccording to the u.s. anti-doping agency (usada), clomiphene in men can potentially boost testosterone levels ""by interfering with the negative feedback loop of the hypothalamic-pituitary-gonadal axis."" the drug is also included on the world anti-doping agency's prohibited list under anti-estrogenic substances.benn began his statement on instagram addressing the ruling saying that while he was ""grateful for the ultimate finding"" of being declared ""innocent of being a drugs cheat,"" he couldn't sit by without commenting on the whole investigation.""it was the right decision and it was the only one i was willing to accept. the easy option would have been to accept a six month ban, save myself a huge legal bill and simply move on, by my reputation and my family name is worth more to me than that,"" he wrote.""at no point did i indicate that i failed any vada tests because of contaminated eggs,"" benn wrote, referring to the voluntary anti-doping association (vada), a third-party testing agency used by the fighters to ensure a clean bout and which carried out his test.""as part of its lengthy investigation, the wbc instructed its own experts to review my supplements and diet, and they concluded that egg contamination was the most likely cause,"" he wrote, saying he provided a 270-page report to the body.benn added: ""however, i feel like the wbc statement did a disservice to my defence, which was based upon a comprehensive scientific review of the testing procedures which set out a number of reasons why we believed the results were completely unreliable and proved beyond any reasonable doubt that i am innocent.""benn is still under investigation from uk anti-doping (ukad) and the bbcofc at the time of publication.he criticized the bbcofc's handling of his case in his statement.""as for the bbboc, they attacked me publicly and privately during the most difficult time in my life, treating me with utter contempt and without any consideration for the fair process or my mental state.""the bbcofc released their own statement on twitter after the announcement from the wbc in february, saying that it was not ""party to the review"" and had not seen ""any evidence provided on mr. benn's behalf.""it added that while ""it respects the wbc, the wbc is a sanctioning body and not a governing body. the bbcofc was the governing body with whom mr. benn was licensed at the material time, and as such any alleged anti-doping violation shall be dealt with in accordance with its rules and regulations.""it pointed to the uk anti-doping rules, brought in by ukad, which the bbcofc adheres to and that as a result, ""the decision of the wbc does not affect the ongoing implantation of the bbcofc's rules (and those of ukad).""cnn has contacted the bbcofc for comment. ukad declined to comment when given the opportunity.benn punches chris algieri during their wba continental welterweight title fight on december 11, 2021.'serious concerns'the wbc's february ruling stated that they had found there to be ""no failures in the procedures"" in relation to benn's sample and test.but benn said he thought there was a lack of transparency throughout the whole investigation, claiming that his sample tested negative three times, but ""without explanation"" was tested nine days later which resulted in the positive test.according to benn, he asked for his b sample from the drug test -- which the world anti-doping agency says ""affords the athlete the opportunity to have second analysis performed in the event their a sample returns"" a positive test -- to be tested as soon as possible.benn also said in his statement that he has been advised to take his case to the court of arbitration for sport.benn said that he had never previously tested positive for a banned substance before october's test, adding to his belief that the result was a ""testing error.""while benn now says that he had to concentrate on ""rebuilding"" his career, the process he has gone through has given him ""serious concerns about the whole testing system"" in boxing.""anti-doping protections are obviously extremely important, but so is ensuring people are given due proves and presumed innocent until proven guilty. cheaters should be caught and punished, but people like me who prove their innocent should be vindicated and allowed to continue their career.""benn admitted that he'd had suicidal thoughts as a result of the whole process, saying: ""i didn't think i'd see another day.""""it's hurt me,"" benn said in an interview with piers morgan on talktv. ""i didn't think i was going to make it through this period. i didn't think i was going to make it through.""when asked if he had felt suicidal, benn replied: ""yeah. yeah, i'd say so -- and it upsets me now because i don't know how i got so bad. i got in a really bad way about it.""i was shamed for something i hadn't even done. ... if i had done something wrong, i'm human. i'd raise my hands to it, 'i made a mistake,' whatever it is, i raise my hands. never this.""i felt seven years of hard work and sacrifice, and leaving my family and the image i maintain, was just ruined by somebody else's incompetence. it's been hard for the family.""backgroundat the time of benn's positive test last year, the bout's promoter, matchroom, and that organization's boss, eddie hearn, had been keen for the bout to go ahead despite it being ""prohibited"" by the bbbofc.hearn told the bbc at the time: ""as we stand right now, the bbbofc is not sanctioning the fight. that does not mean the fight is off, but there is a process we have to go through.""conor benn is not suspended, he is free and clear to fight. there's lots going on with the lawyers.""eddie hearn, boxing promoter of matchroom boxing, speaks at the press conference ahead of benn's scheduled fight with eubank jr.amid mounting public pressure and safety concerns, the fight was canceled.the decision to overlook potential safety concerns and stage a bout including a fighter who had tested positive for a banned substance prompted criticism that boxing prioritizes the fight's money-making opportunities rather than the boxers' safety.weeks later, the bbbofc claimed that benn voluntarily relinquished his license with the governing body just before allegations of misconduct against benn were upheld.benn accused the bbbofc of conducting an ""unfair and biased procedure."" he also disputes that he relinquished his license.""(benn) strongly refutes the allegation of misconduct (which for the avoidance of doubt is not in relation to the vada issue) and firmly believes that an independent tribunal will reach a wholly different conclusion,"" a statement said on benn's twitter at the time.and a few months later, the wbc announced after it had conducted an investigation into the matter that benn would be included in its ratings once again after it found that he had not ""engaged in intentional or knowing ingestion of clomiphene."""
93,93,https://edition.cnn.com/2023/03/06/sport/nfl-calvin-ridley-gambling-reinstated-spt,NFL reinstates Jaguars wide receiver Calvin Ridley after year-long suspension for gambling on NFL games,"(CNN) Jacksonville Jaguars wide receiver Calvin Ridley has been reinstated after he was suspended indefinitely after gambling on NFL games during the 2021 season as a member of the Atlanta Falcons, the league said Monday.

""Ridley, who had been suspended indefinitely since March 2022 for violating the NFL's gambling policy, is eligible to participate in all team activities, effective immediately,"" officials said.

Ridley, 28, said the suspension was self-inflicted and ""an isolated lapse in judgment.""

""I have always owned my mistakes and this is no different,"" Ridley said in a statement. ""I have great respect for the game and am excited for the opportunity to restart my career in Jacksonville. I look forward to showing my new coaches, teammates, and the entire Jaguars organization exactly who I am and what I represent as a player and person.""

Ridley's last NFL game was October 24, 2021, after which he stepped away from football to focus on his mental health.",['Kevin Dotson'],2023-03-06,"jacksonville jaguars wide receiver calvin ridley has been reinstated after he was suspended indefinitely after gambling on nfl games during the 2021 season as a member of the atlanta falcons, the league said monday.""ridley, who had been suspended indefinitely since march 2022 for violating the nfl's gambling policy, is eligible to participate in all team activities, effective immediately,"" officials said.ridley, 28, said the suspension was self-inflicted and ""an isolated lapse in judgment.""""i have always owned my mistakes and this is no different,"" ridley said in a statement. ""i have great respect for the game and am excited for the opportunity to restart my career in jacksonville. i look forward to showing my new coaches, teammates, and the entire jaguars organization exactly who i am and what i represent as a player and person.""ridley's last nfl game was october 24, 2021, after which he stepped away from football to focus on his mental health."
