,Unnamed: 0,url,title,text,author,date,clean_text
0,0,https://edition.cnn.com/2023/02/28/sport/los-angeles-lakers-players-qualify-nba-spt-intl,"Lebron James: Without injured star, can the LA Lakers make the playoffs? Here's how it could happen","During the Lakers' 27-point comeback victory over the Dallas Mavericks on Sunday, TV cameras caught LeBron James saying he heard his foot ""pop"" when landing from a layup. The 38-year-old was seen walking gingerly after the game despite being able to finish the win.

Just as the Lakers seem to be building some momentum with a three-game winning streak, with their stars shining and the new additions playing their part, James looks set to be in for a spell on the sidelines.

Multiple reports say the 19-time All-Star could miss several weeks, but is awaiting further tests to determine the full extent of the injury.

James posted a photo of his injured foot to his Instagram story on Monday, after it was announced he would miss the match against the Memphis Grizzlies, along with the caption: ""Fkn sucks!!!!""

Just another day in 'Laker Land' -- and it couldn't have come at a worse time.

With 21 games remaining and sitting two spots outside of a spot in the postseason's play-in tournament -- and six spots away from automatic qualification to the playoffs -- the Lakers remain in danger of missing the playoffs for the second successive season. Or will we see those famous yellow and purple uniforms in the NBA's business end of the season?

Dennis Schröder of the Los Angeles Lakers shoots over Jonas Valančiūnas of the New Orleans Pelicans.

Steadily improving

For such a storied franchise and one which was crowned NBA champion just over two years ago, this season has been one full of questions and arguably not one coming up with the right answers.

Heading into the season, general manager Rob Pelinka had his work cut out to round out the team's roster, even with superstars like James and Anthony Davis on the books -- all with limited draft capital largely thanks to the widely criticized trade for Russell Westbrook.

The acquisition of Patrick Beverley in August filled a need but many pundits believed that the Lakers had not done enough to put themselves in contention to compete for a title.

Criticism from fans and pundits was even louder because of the finite amount of time it appears James has left at the top level as he approaches 40 and Pelinka's inability to build a contender around arguably the NBA's greatest player.

So the season began as many predicted, with the Lakers winning just two of their first 12 games. On November 12, the Lakers were 14th in the Western Conference.

To the credit of first-year head coach Darvin Ham and the team's leading players, the Lakers dug themselves out of a hole, winning eight of their next 10 games.

But down to a combination of injuries, lack of consistency and a lopsided roster, the Lakers struggled to kick on and make a serious surge up the standings or show their championship mettle.

Midseason trades seemed to address some of the team's issues of a lack of defense and shooting from the perimeter -- Malik Beasley, D'Angelo Russell, Jarred Vanderbilt, Mo Bamba and Davon Reed arriving, while Westbrook was finally shipped out.

After Sunday's win over the Mavericks, Dallas head coach Jason Kidd said Vanderbilt ""kicked our a*s.""

Since the two trades on February 9, the team has gone 4-2 and seemingly turned its season on its head.

James shoots while Jayson Tatum of the Boston Celtics defends.

What are chances of the Lakers in the playoffs?

In any NBA season until 2020, the Lakers' chances of competing in the playoffs would be seriously diminished with only eight teams qualifying.

But following the introduction of the play-in tournament during the bubble season in the height of the Covid-19 pandemic, a postseason berth is still within the team's grasp.

The play-in tournament whittles down the teams ranked seventh to 10th in each conference to determine the final two spots in the playoffs. The seventh seeded team hosts the eighth, with the winner earning the No. 7 seed in the playoffs.

The ninth seeded team hosts the 10th ranked side, with the winner facing the loser of the game between the seventh and eighth seeds; the winner of this game will get the eighth and final spot in the playoff bracket.

It means that at the time of writing, the Lakers are currently on a three-game winning streak, have a record of 29-32 and sit 12th in the Western Conference; a game outside the play-in tournament. They are only two-and-a-half games outside of the sixth spot which would qualify them automatically for the playoffs.

According to the website Tankathon which measures the difficulty of a team's remaining schedule for the rest of the season, the Lakers have the fifth easiest slate of games left.

It has been a far from perfect season for the Lakers so far, but it appears as if they might be coming into some form after the All-Star break.

Tied in the win column with a similarly imperfect Portland Trail Blazers, we could well be seeing the 17-time NBA champion duking it out in the play-in -- James' injury permitting.

Who knows, in a congested Western Conference, the Lakers could even reach the playoffs using the old-fashioned method.",['Ben Morse'],2023-02-28,"during the lakers' 27-point comeback victory over the dallas mavericks on sunday, tv cameras caught lebron james saying he heard his foot ""pop"" when landing from a layup. the 38-year-old was seen walking gingerly after the game despite being able to finish the win.just as the lakers seem to be building some momentum with a three-game winning streak, with their stars shining and the new additions playing their part, james looks set to be in for a spell on the sidelines.multiple reports say the 19-time all-star could miss several weeks, but is awaiting further tests to determine the full extent of the injury.james posted a photo of his injured foot to his instagram story on monday, after it was announced he would miss the match against the memphis grizzlies, along with the caption: ""fkn sucks!!!!""just another day in 'laker land' -- and it couldn't have come at a worse time.with 21 games remaining and sitting two spots outside of a spot in the postseason's play-in tournament -- and six spots away from automatic qualification to the playoffs -- the lakers remain in danger of missing the playoffs for the second successive season. or will we see those famous yellow and purple uniforms in the nba's business end of the season?dennis schrder of the los angeles lakers shoots over jonas valaninas of the new orleans pelicans.steadily improvingfor such a storied franchise and one which was crowned nba champion just over two years ago, this season has been one full of questions and arguably not one coming up with the right answers.heading into the season, general manager rob pelinka had his work cut out to round out the team's roster, even with superstars like james and anthony davis on the books -- all with limited draft capital largely thanks to the widely criticized trade for russell westbrook.the acquisition of patrick beverley in august filled a need but many pundits believed that the lakers had not done enough to put themselves in contention to compete for a title.criticism from fans and pundits was even louder because of the finite amount of time it appears james has left at the top level as he approaches 40 and pelinka's inability to build a contender around arguably the nba's greatest player.so the season began as many predicted, with the lakers winning just two of their first 12 games. on november 12, the lakers were 14th in the western conference.to the credit of first-year head coach darvin ham and the team's leading players, the lakers dug themselves out of a hole, winning eight of their next 10 games.but down to a combination of injuries, lack of consistency and a lopsided roster, the lakers struggled to kick on and make a serious surge up the standings or show their championship mettle.midseason trades seemed to address some of the team's issues of a lack of defense and shooting from the perimeter -- malik beasley, d'angelo russell, jarred vanderbilt, mo bamba and davon reed arriving, while westbrook was finally shipped out.after sunday's win over the mavericks, dallas head coach jason kidd said vanderbilt ""kicked our a*s.""since the two trades on february 9, the team has gone 4-2 and seemingly turned its season on its head.james shoots while jayson tatum of the boston celtics defends.what are chances of the lakers in the playoffs?in any nba season until 2020, the lakers' chances of competing in the playoffs would be seriously diminished with only eight teams qualifying.but following the introduction of the play-in tournament during the bubble season in the height of the covid-19 pandemic, a postseason berth is still within the team's grasp.the play-in tournament whittles down the teams ranked seventh to 10th in each conference to determine the final two spots in the playoffs. the seventh seeded team hosts the eighth, with the winner earning the no. 7 seed in the playoffs.the ninth seeded team hosts the 10th ranked side, with the winner facing the loser of the game between the seventh and eighth seeds; the winner of this game will get the eighth and final spot in the playoff bracket.it means that at the time of writing, the lakers are currently on a three-game winning streak, have a record of 29-32 and sit 12th in the western conference; a game outside the play-in tournament. they are only two-and-a-half games outside of the sixth spot which would qualify them automatically for the playoffs.according to the website tankathon which measures the difficulty of a team's remaining schedule for the rest of the season, the lakers have the fifth easiest slate of games left.it has been a far from perfect season for the lakers so far, but it appears as if they might be coming into some form after the all-star break.tied in the win column with a similarly imperfect portland trail blazers, we could well be seeing the 17-time nba champion duking it out in the play-in -- james' injury permitting.who knows, in a congested western conference, the lakers could even reach the playoffs using the old-fashioned method."
1,1,https://edition.cnn.com/2023/02/16/sport/lesley-paterson-all-quiet-on-the-western-front-film-triathlon-spt-intl,How a world champion triathlete earned an Oscar nomination,"(CNN) It's while running in the moors and hills of her native Scotland that Lesley Paterson sometimes sees her two careers become conveniently aligned.

A professional triathlete and screenwriter, Paterson has long inhabited two livelihoods that, on the surface, seem worlds apart. But in the quiet moments of a windswept run or a long bike ride, the occasional flash of inspiration can form the basis of her best ideas for film scripts.

She counts among those the opening scenes of the Oscar-nominated ""All Quiet on the Western Front,"" an adaptation of Erich Maria Remarque's anti-war novel of the same name published in 1929.

The film begins in the trenches of the First World War, where much of the action is situated, before we are soon transported to a provincial town in Germany. There, Paul Bäumer -- a young army recruit and the story's protagonist -- notices how his new military uniform carries the name tag of another solider.

Unbeknownst to Bäumer, who is awkwardly told that the clothes were too small for their intended recipient, the soldier has apparently been killed in the war and his uniform recycled.

""It really sort of encapsulates the entire message of the film -- that the uniform's more important than the man,"" Paterson tells CNN Sport

""It's just one of those moments where you know it's good and you think: 'Oh my God ... where did this come from?' You feel so lucky that you've thought of it.""

The scene, first visualized on a run in the Scottish Highlands, proved prescient. Last year, Russian soldiers fighting in Ukraine complained of having to buy their own uniforms amid a shortage of basic equipment

""If we can hold up a mirror to what's going on to try and prevent more from happening, that truly is my goal as a storyteller -- to effect change,"" says Paterson.

Felix Kammerer stars as Paul Bäumer in ""All Quiet on the Western Front.""

First portrayed on screen in a much-loved Hollywood film nearly 100 years ago, ""All Quiet"" focuses on the tragedy and ruin of war, eschewing any notions of heroism or adventure.

Paterson, alongside writing partner Ian Stokell, got the option to the rights in 2006 but had to wait until 2020 before Netflix commissioned it as a German-language film.

The end product, which includes a new narrative strand focused on the Armistice Talks between German and French officials, captures the bloodshed and horror of the world's first mechanized war in chilling detail.

It has been met with great critical acclaim, receiving nine Oscar nominations -- including for best adapted screenplay -- and a record-equaling 14 BAFTA nominations

The BAFTA awards ceremony will be held on Sunday, while the Oscars take place on March 13 -- two events that, for Paterson, will cap off years of hard work, stress and dogged resolve.

A five-time world champion across two formats of off-road triathlon, she relied on her sporting career as a source of income when it came to renewing the option contract each year, even to the extent that she forced herself to race through injury and acute pain.

That was in 2016, when Paterson fell off her bike and broke her shoulder the day before she was due to compete in Costa Rica. Partly devastated by the thought of not racing and partly overwhelmed by pain, she started to search for a solution.

With the help of her husband and her physio, she discovered she could still run and was able to ride her bike by propping her arm on the handlebars, leaving only the mile-long sea swim to consider.

""I do a lot of one-arm drills,"" says Paterson. ""I was always really good at it and I've got a very strong leg kick. I practiced in the ocean and I was like: 'Well, I can do one arm, let's give this a shot.'""

After finishing the swim some 15 minutes behind the rest of the field, Paterson made up ground on the 40-kilometer mountain bike section before taking the lead on the 10-kilometer run.

""I just kind of kept on going,"" she says. ""And then I ran off into the forest and it was just an exercise in perseverance and thinking outside the box. I had to get something done.""

Triathlete Lesley Paterson competes for Great Britain in Birmingham, Alabama, in 2012.

The experience, itself worthy of a film script, was emblematic of the way Paterson approached triathlon throughout her life.

""I don't know if that's the sort of Scottish underdog mentality or if it's just truly I'm driven by a joy and passion and not so worried about outcomes,"" she says. ""I'm a very sort of passionate, heart-driven athlete.""

Paterson has mostly competed on the XTERRA cross-triathlon series -- ""all off-road and muddy and gritty and out in nature,"" she says -- having previously missed out on qualifying for the Olympics with Great Britain at the start of her career.

After she moved to California in her twenties to further her film studies, competing in -- and winning -- races became a welcome financial boost, particularly as she looked to get ""All Quiet"" off the ground.

""Every year we had to weigh up the option payment was incredibly stressful because it's a lot of money,"" says Paterson.

""Me doing well at racing was a huge piece of that because you could get a lump sum of money that wasn't necessarily expected. A big way that we funded the film was me racing and doing well. It was a massive motivation.""

Over the years, Paterson has seen her two careers become curiously intertwined. She has channeled the same energy and enthusiasm into both disciplines, driven, she says, by a love for what she's doing and an obsessive attention to detail.

""I've always had these two simultaneous passions: the artist in me and the athlete in me,"" says Paterson.

""People think they are often very separate, but they're actually very, very similar in terms of the skills you build and utilize and how one can help the other. I'd say that I truly am the athlete I am because I'm an artist and the artist I am because I'm an athlete.""

""All Quiet on the Western Front"" was released last year and has been highly acclaimed.

Whether it's sports or scriptwriting, Paterson says she has a habit of ""looking for the biggest challenge and just kind of jumping in.""

It perhaps explains why she played rugby until the age of 12 -- the only girl in a team of boys -- and why she chose to tackle ""All Quiet"" at a time when war films were out of fashion in the industry.

The tide has slowly turned in her favor on that front, particularly with the release of Sam Mendes' ""1917"" four years ago.

And with the landscape shifting towards foreign language cinema, director Edward Berger and producer Malte Grunert suggested pitching ""All Quiet"" in German, rather than English.

""There's an authenticity -- it's their story, it's their national novel, it's rightly so that it's in German,"" says Paterson.

The popularity of ""All Quiet"" may take Paterson's life in a different direction, especially now that she's 42 and her racing career is almost over. She still coaches triathlon but expects to devote more time to film in the future.

Whatever she does next, Paterson will still be guided by the same simple philosophy.

""It's focusing on the mastery of the craft and not focusing on the outcomes -- that was a huge learning curve for me,"" she says.

""As long as you have incredible passion and focus and stop thinking about where you want to be and being in the moment with where you're at ... That's where the beauty comes.""",['George Ramsay'],2023-02-16,"it's while running in the moors and hills of her native scotland that lesley paterson sometimes sees her two careers become conveniently aligned.a professional triathlete and screenwriter, paterson has long inhabited two livelihoods that, on the surface, seem worlds apart. but in the quiet moments of a windswept run or a long bike ride, the occasional flash of inspiration can form the basis of her best ideas for film scripts.she counts among those the opening scenes of the oscar-nominated ""all quiet on the western front,"" an adaptation of erich maria remarque's anti-war novel of the same name published in 1929.the film begins in the trenches of the first world war, where much of the action is situated, before we are soon transported to a provincial town in germany. there, paul bumer -- a young army recruit and the story's protagonist -- notices how his new military uniform carries the name tag of another solider.unbeknownst to bumer, who is awkwardly told that the clothes were too small for their intended recipient, the soldier has apparently been killed in the war and his uniform recycled.""it really sort of encapsulates the entire message of the film -- that the uniform's more important than the man,"" paterson tells cnn sport""it's just one of those moments where you know it's good and you think: 'oh my god ... where did this come from?' you feel so lucky that you've thought of it.""the scene, first visualized on a run in the scottish highlands, proved prescient. last year, russian soldiers fighting in ukraine complained of having to buy their own uniforms amid a shortage of basic equipment""if we can hold up a mirror to what's going on to try and prevent more from happening, that truly is my goal as a storyteller -- to effect change,"" says paterson.felix kammerer stars as paul bumer in ""all quiet on the western front.""first portrayed on screen in a much-loved hollywood film nearly 100 years ago, ""all quiet"" focuses on the tragedy and ruin of war, eschewing any notions of heroism or adventure.paterson, alongside writing partner ian stokell, got the option to the rights in 2006 but had to wait until 2020 before netflix commissioned it as a german-language film.the end product, which includes a new narrative strand focused on the armistice talks between german and french officials, captures the bloodshed and horror of the world's first mechanized war in chilling detail.it has been met with great critical acclaim, receiving nine oscar nominations -- including for best adapted screenplay -- and a record-equaling 14 bafta nominationsthe bafta awards ceremony will be held on sunday, while the oscars take place on march 13 -- two events that, for paterson, will cap off years of hard work, stress and dogged resolve.a five-time world champion across two formats of off-road triathlon, she relied on her sporting career as a source of income when it came to renewing the option contract each year, even to the extent that she forced herself to race through injury and acute pain.that was in 2016, when paterson fell off her bike and broke her shoulder the day before she was due to compete in costa rica. partly devastated by the thought of not racing and partly overwhelmed by pain, she started to search for a solution.with the help of her husband and her physio, she discovered she could still run and was able to ride her bike by propping her arm on the handlebars, leaving only the mile-long sea swim to consider.""i do a lot of one-arm drills,"" says paterson. ""i was always really good at it and i've got a very strong leg kick. i practiced in the ocean and i was like: 'well, i can do one arm, let's give this a shot.'""after finishing the swim some 15 minutes behind the rest of the field, paterson made up ground on the 40-kilometer mountain bike section before taking the lead on the 10-kilometer run.""i just kind of kept on going,"" she says. ""and then i ran off into the forest and it was just an exercise in perseverance and thinking outside the box. i had to get something done.""triathlete lesley paterson competes for great britain in birmingham, alabama, in 2012.the experience, itself worthy of a film script, was emblematic of the way paterson approached triathlon throughout her life.""i don't know if that's the sort of scottish underdog mentality or if it's just truly i'm driven by a joy and passion and not so worried about outcomes,"" she says. ""i'm a very sort of passionate, heart-driven athlete.""paterson has mostly competed on the xterra cross-triathlon series -- ""all off-road and muddy and gritty and out in nature,"" she says -- having previously missed out on qualifying for the olympics with great britain at the start of her career.after she moved to california in her twenties to further her film studies, competing in -- and winning -- races became a welcome financial boost, particularly as she looked to get ""all quiet"" off the ground.""every year we had to weigh up the option payment was incredibly stressful because it's a lot of money,"" says paterson.""me doing well at racing was a huge piece of that because you could get a lump sum of money that wasn't necessarily expected. a big way that we funded the film was me racing and doing well. it was a massive motivation.""over the years, paterson has seen her two careers become curiously intertwined. she has channeled the same energy and enthusiasm into both disciplines, driven, she says, by a love for what she's doing and an obsessive attention to detail.""i've always had these two simultaneous passions: the artist in me and the athlete in me,"" says paterson.""people think they are often very separate, but they're actually very, very similar in terms of the skills you build and utilize and how one can help the other. i'd say that i truly am the athlete i am because i'm an artist and the artist i am because i'm an athlete.""""all quiet on the western front"" was released last year and has been highly acclaimed.whether it's sports or scriptwriting, paterson says she has a habit of ""looking for the biggest challenge and just kind of jumping in.""it perhaps explains why she played rugby until the age of 12 -- the only girl in a team of boys -- and why she chose to tackle ""all quiet"" at a time when war films were out of fashion in the industry.the tide has slowly turned in her favor on that front, particularly with the release of sam mendes' ""1917"" four years ago.and with the landscape shifting towards foreign language cinema, director edward berger and producer malte grunert suggested pitching ""all quiet"" in german, rather than english.""there's an authenticity -- it's their story, it's their national novel, it's rightly so that it's in german,"" says paterson.the popularity of ""all quiet"" may take paterson's life in a different direction, especially now that she's 42 and her racing career is almost over. she still coaches triathlon but expects to devote more time to film in the future.whatever she does next, paterson will still be guided by the same simple philosophy.""it's focusing on the mastery of the craft and not focusing on the outcomes -- that was a huge learning curve for me,"" she says.""as long as you have incredible passion and focus and stop thinking about where you want to be and being in the moment with where you're at ... that's where the beauty comes."""
