,Unnamed: 0,url,title,text,author,date,clean_text
10,10,https://edition.cnn.com/2023/02/22/golf/golf-outrageous-fashion-spt-spc-intl,The most outrageous golf fashion outfits,"(CNN) There have been a lot of dull outfits on the fairways over the years -- monochrome colors, polo shirts, and plain caps galore. Sometimes a flock of enthusiastic fans in Tiger onesies is the height of stylistic expression at a PGA Tour event.

Yet every now and then, a budding fairway fashionista pushes the envelope and makes a wardrobe decision that proves that golf can, in fact, serve up some memorable looks.

Whether they are memorable for the right reasons is another debate entirely. While Payne Stewart's sartorial elegance and seemingly bottomless wardrobe of knickers saw his fashion reputation transcend golf, there was also the wearable eyesore that was Team USA's 1999 Ryder Cup outfit -- so bad that Tiger Woods confessed to burning it for warmth.

Photos: The world's most extreme golf courses Photos: The world's most extreme golf courses Most golf courses follow a familiar set of customs. Others though, follow a different script, like La Jenny in southwest France. At the world's only naturist golf course, nudity is the compulsory dress code, with exceptions made for bad weather. Hide Caption 1 of 14 Photos: The world's most extreme golf courses At Kantarat Golf Course in Bangkok, golfers navigate the fairways while, either side of them, airplanes land and takeoff on the runways of Don Mueang International Airport. Hide Caption 2 of 14 Photos: The world's most extreme golf courses Camp Bonifas' one-hole course is set at a military garrison just a stone's throw away from the Demilitarized Zone that divides North and South Korea. Barbed wire and trenches ring the fairways, and a stray ball once detonated a land mine, Dubbed ""The World's Most Dangerous Golf Course,""one-hole course is set at a military garrison just a stone's throw away from the Demilitarized Zone that divides North and South Korea. Barbed wire and trenches ring the fairways, and a stray ball once detonated a land mine, according to a 1998 Washington Post article. Hide Caption 3 of 14 Photos: The world's most extreme golf courses The annual World Ice Golf Championship was long-hosted in Uummannaq, Greenland. Holes were made bigger and balls were brightly colored so they could be spotted amid the snow and ice. Hide Caption 4 of 14 Photos: The world's most extreme golf courses At the Volcano Golf Course in Hawaii, fairways run alongside the crater rim of Kilauea. One of the world's most active volcanoes, an eruption in 2018 (pictured) offered golfers a stunning backdrop to play in front of. Hide Caption 5 of 14 Photos: The world's most extreme golf courses Idaho's Coeur D'Alene Resort Golf Course boasts a unique 14th hole that is as technologically impressive as it is challenging. Claimed to be the world's only floating, movable island green, underwater cables allow operators to move the green to the required tee distance. Hide Caption 6 of 14 Photos: The world's most extreme golf courses Swing low at Furnace Creek Golf Course at Death Valley, California. At 214 feet below sea level, the course claims to be the lowest elevation course in the world. With summer temperatures at Death Valley peaking as high as 49 degrees Celsius (120 degrees Fahrenheit), it can also be a toasty trip round the fairways. Hide Caption 7 of 14 Photos: The world's most extreme golf courses Accessible by helicopter, ""The Extreme 19th"" hole at South Africa's Legend Golf and Safari Resort is not ideal for those with a fear of heights. Golfers must drive from a tee 4,500 feet above sea level towards a green -- shaped like the African continent -- 361 meters (395 yards) away. Hide Caption 8 of 14 Photos: The world's most extreme golf courses At Kiawah Island's Ocean Course, alligators are as welcome as golfers. The South Carolina resort encourages a peaceful co-existence between players and the reptiles, who form part of a vibrant eco-system that includes dolphins and bobcats. Hide Caption 9 of 14 Photos: The world's most extreme golf courses Considered to be the site of the highest golf courses in the world, La Paz Golf Club in Bolivia sees players take in stunning views at over 3,300 meters (10,826 feet) above sea level. Hide Caption 10 of 14 Photos: The world's most extreme golf courses Kabul Golf Course has a history unlike any other. Founded in 1967, it was used as a military base by the invading Soviet Army the following decade. Later, the club's bar was blown apart by the Taliban for selling alcohol, the course operator Mohammed Afzal Abdul Afghanistan'shas a history unlike any other. Founded in 1967, it was used as a military base by the invading Soviet Army the following decade. Later, the club's bar was blown apart by the Taliban for selling alcohol, the course operator Mohammed Afzal Abdul told CNN in 2009. Hide Caption 11 of 14 Photos: The world's most extreme golf courses Vipingo Ridge in Kenya, Africa's only PGA-accredited golf course, an array of wildlife freely Atin Kenya, Africa's only PGA-accredited golf course, an array of wildlife freely roams the greens and fairways. Doubling up as a sanctuary for giraffes, zebras, and other species, the course has hosted the Magical Kenya Ladies Open, an event on the Ladies European Tour. Hide Caption 12 of 14 Photos: The world's most extreme golf courses There's no such thing as a quick game at Nullarbor Links in Australia. At the world's longest course, golfers tee off at Ceduna in the country's east before finishing up their round at Kalgoorlie, some 863 miles away in the west. Hide Caption 13 of 14 Photos: The world's most extreme golf courses Fans of motor-racing and golf will find perfect harmony at Brickyard Crossing Golf Club, where four of the 18 holes are located within the circumference of the fabled track. The course has hosted several events, including the Indy Women In Tech Championship in 2019 (Pictured, Mi Jung Hur) Hide Caption 14 of 14

Some looks became a signature. Head to toe in fluorescent orange? Had to be Rickie Fowler. Cowboy hat and belt? Shingo Katayama was in town. And for absolutely everything in between, the unmatched John Daly -- perhaps the only golfer in history you could bank on to make the fashion statement at whichever event he was playing that week.

Scroll through the gallery above to explore some of the most unforgettable outfits in men's golf.",['Jack Bantock'],2023-02-22,"there have been a lot of dull outfits on the fairways over the years -- monochrome colors, polo shirts, and plain caps galore. sometimes a flock of enthusiastic fans in tiger onesies is the height of stylistic expression at a pga tour event.yet every now and then, a budding fairway fashionista pushes the envelope and makes a wardrobe decision that proves that golf can, in fact, serve up some memorable looks.whether they are memorable for the right reasons is another debate entirely. while payne stewart's sartorial elegance and seemingly bottomless wardrobe of knickers saw his fashion reputation transcend golf, there was also the wearable eyesore that was team usa's 1999 ryder cup outfit -- so bad that tiger woods confessed to burning it for warmth.photos: the world's most extreme golf courses photos: the world's most extreme golf courses most golf courses follow a familiar set of customs. others though, follow a different script, like la jenny in southwest france. at the world's only naturist golf course, nudity is the compulsory dress code, with exceptions made for bad weather. hide caption 1 of 14 photos: the world's most extreme golf courses at kantarat golf course in bangkok, golfers navigate the fairways while, either side of them, airplanes land and takeoff on the runways of don mueang international airport. hide caption 2 of 14 photos: the world's most extreme golf courses camp bonifas' one-hole course is set at a military garrison just a stone's throw away from the demilitarized zone that divides north and south korea. barbed wire and trenches ring the fairways, and a stray ball once detonated a land mine, dubbed ""the world's most dangerous golf course,""one-hole course is set at a military garrison just a stone's throw away from the demilitarized zone that divides north and south korea. barbed wire and trenches ring the fairways, and a stray ball once detonated a land mine, according to a 1998 washington post article. hide caption 3 of 14 photos: the world's most extreme golf courses the annual world ice golf championship was long-hosted in uummannaq, greenland. holes were made bigger and balls were brightly colored so they could be spotted amid the snow and ice. hide caption 4 of 14 photos: the world's most extreme golf courses at the volcano golf course in hawaii, fairways run alongside the crater rim of kilauea. one of the world's most active volcanoes, an eruption in 2018 (pictured) offered golfers a stunning backdrop to play in front of. hide caption 5 of 14 photos: the world's most extreme golf courses idaho's coeur d'alene resort golf course boasts a unique 14th hole that is as technologically impressive as it is challenging. claimed to be the world's only floating, movable island green, underwater cables allow operators to move the green to the required tee distance. hide caption 6 of 14 photos: the world's most extreme golf courses swing low at furnace creek golf course at death valley, california. at 214 feet below sea level, the course claims to be the lowest elevation course in the world. with summer temperatures at death valley peaking as high as 49 degrees celsius (120 degrees fahrenheit), it can also be a toasty trip round the fairways. hide caption 7 of 14 photos: the world's most extreme golf courses accessible by helicopter, ""the extreme 19th"" hole at south africa's legend golf and safari resort is not ideal for those with a fear of heights. golfers must drive from a tee 4,500 feet above sea level towards a green -- shaped like the african continent -- 361 meters (395 yards) away. hide caption 8 of 14 photos: the world's most extreme golf courses at kiawah island's ocean course, alligators are as welcome as golfers. the south carolina resort encourages a peaceful co-existence between players and the reptiles, who form part of a vibrant eco-system that includes dolphins and bobcats. hide caption 9 of 14 photos: the world's most extreme golf courses considered to be the site of the highest golf courses in the world, la paz golf club in bolivia sees players take in stunning views at over 3,300 meters (10,826 feet) above sea level. hide caption 10 of 14 photos: the world's most extreme golf courses kabul golf course has a history unlike any other. founded in 1967, it was used as a military base by the invading soviet army the following decade. later, the club's bar was blown apart by the taliban for selling alcohol, the course operator mohammed afzal abdul afghanistan'shas a history unlike any other. founded in 1967, it was used as a military base by the invading soviet army the following decade. later, the club's bar was blown apart by the taliban for selling alcohol, the course operator mohammed afzal abdul told cnn in 2009. hide caption 11 of 14 photos: the world's most extreme golf courses vipingo ridge in kenya, africa's only pga-accredited golf course, an array of wildlife freely atin kenya, africa's only pga-accredited golf course, an array of wildlife freely roams the greens and fairways. doubling up as a sanctuary for giraffes, zebras, and other species, the course has hosted the magical kenya ladies open, an event on the ladies european tour. hide caption 12 of 14 photos: the world's most extreme golf courses there's no such thing as a quick game at nullarbor links in australia. at the world's longest course, golfers tee off at ceduna in the country's east before finishing up their round at kalgoorlie, some 863 miles away in the west. hide caption 13 of 14 photos: the world's most extreme golf courses fans of motor-racing and golf will find perfect harmony at brickyard crossing golf club, where four of the 18 holes are located within the circumference of the fabled track. the course has hosted several events, including the indy women in tech championship in 2019 (pictured, mi jung hur) hide caption 14 of 14some looks became a signature. head to toe in fluorescent orange? had to be rickie fowler. cowboy hat and belt? shingo katayama was in town. and for absolutely everything in between, the unmatched john daly -- perhaps the only golfer in history you could bank on to make the fashion statement at whichever event he was playing that week.scroll through the gallery above to explore some of the most unforgettable outfits in men's golf."
11,11,https://edition.cnn.com/2023/02/26/sport/armand-duplantis-sixth-world-record-pole-vault-spt-intl,Olympic champion Armand Duplantis breaks pole vault world record for sixth time,"(CNN) He may only be 23 years old, but Armand Duplantis is already a sporting great.

An Olympic, World and European champion already, the Swedish athlete has become accustomed to also breaking world records.

And he did so again on Saturday, breaking the pole vault word record for the sixth time at the All Star Perche 2023 event in Clermont-Ferrand, France.

🚨 𝐑𝐄𝐂𝐎𝐑𝐃 𝐃𝐔 𝐌𝐎𝐍𝐃𝐄 ! 🌎



🤩 Phénoménal ! 🇸🇪 Armand Duplantis est sur le toit du monde à Clermont-Ferrand en s'élevant à 6️⃣,2️⃣2️⃣ m !



Il faudra bientôt relever le plafond ! 😱



📺 Revivez le @AllStarPerche en 𝗥𝗘𝗣𝗟𝗔𝗬 sur https://t.co/xgXE6U6Tof pic.twitter.com/ihgsZ81aoh — FFAthlétisme (@FFAthletisme) February 25, 2023

Duplantis added a centimeter to the world record of 6.21m he had previously set at the World Championships in Oregon last year

He achieved the new world record of 6.22m on his third attempt having hit the bar with his previous two tries.

Read More",['Ben Morse'],2023-02-26,"he may only be 23 years old, but armand duplantis is already a sporting great.an olympic, world and european champion already, the swedish athlete has become accustomed to also breaking world records.and he did so again on saturday, breaking the pole vault word record for the sixth time at the all star perche 2023 event in clermont-ferrand, france.    !  phnomnal !  armand duplantis est sur le toit du monde  clermont-ferrand en s'levant  6,22 m !il faudra bientt relever le plafond !  revivez le @allstarperche en  sur  pic.twitter.com/ihgsz81aoh  ffathltisme (@ffathletisme) february 25, 2023duplantis added a centimeter to the world record of 6.21m he had previously set at the world championships in oregon last yearhe achieved the new world record of 6.22m on his third attempt having hit the bar with his previous two tries.read more"
12,12,https://edition.cnn.com/2023/02/25/tennis/jessica-pegula-doritos-tweet-spt-intl,US tennis star Jessica Pegula reduced to 'sitting eating doritos at midnight' after birthday 'bagel',"(CNN) Some parts of being a professional tennis player aren't glamorous.

And world No. 3 Jessica Pegula revealed the unglamorous side of the sport in a funny tweet after losing 6-1 5-7 6-0 to Barbora Krejčíková in the Dubai Championships semifinals on Friday.

""Everyone: ""What is it like playing on tour? It must be so amazing!""

""Me: gets bagled on your birthday, sitting eating Doritos at midnight, waiting to get on a 16 hr flight home,"" the American tweeted, alongside a selfie of her eating the crisps.

Everyone: ""What is it like playing on tour? It must be so amazing!""



Me: gets bagled on your birthday, sitting eating Doritos at midnight, waiting to get on a 16 hr flight home. 🤣 pic.twitter.com/5YqSZ0xHx5 — Jessie Pegula (@JLPegula) February 24, 2023

As well as reaching the semifinals in Dubai, Pegula reached the final of the Qatar Open last week, where she was defeated by the in-form Iga Swiatek.

Read More",['Issy Ronald'],2023-02-25,"some parts of being a professional tennis player aren't glamorous.and world no. 3 jessica pegula revealed the unglamorous side of the sport in a funny tweet after losing 6-1 5-7 6-0 to barbora krejkov in the dubai championships semifinals on friday.""everyone: ""what is it like playing on tour? it must be so amazing!""""me: gets bagled on your birthday, sitting eating doritos at midnight, waiting to get on a 16 hr flight home,"" the american tweeted, alongside a selfie of her eating the crisps.everyone: ""what is it like playing on tour? it must be so amazing!""me: gets bagled on your birthday, sitting eating doritos at midnight, waiting to get on a 16 hr flight home.  pic.twitter.com/5yqsz0xhx5  jessie pegula (@jlpegula) february 24, 2023as well as reaching the semifinals in dubai, pegula reached the final of the qatar open last week, where she was defeated by the in-form iga swiatek.read more"
13,13,https://edition.cnn.com/2023/02/28/football/achraf-hakimi-rape-investigation-spt-intl,"Rape investigation opened into Moroccan soccer player Achraf Hakimi, according to source close to investigation","(CNN) French judicial authorities have opened an investigation for rape into Moroccan soccer player Achraf Hakimi, a source close to the investigation confirmed to CNN on Tuesday.

The Nanterre prosecutor's office, just outside of Paris, is leading the investigation, the source added.

Spanish-born Moroccan Hakimi is a full-back for Paris Saint-Germain and plays for the Moroccan national side. He scored the penalty kick that took Morocco to the World Cup semifinals during Qatar 2022.

""The Nanterre prosecutor's office does not wish to comment on this ongoing investigation, as the information already published jeopardizes the inquiries necessary for finding the truth,"" the prosecutor's office told CNN.

CNN has reached out to Hakimi for comment.

Read More","['Joseph Ataman', 'Sammy Mngqosini']",2023-02-28,"french judicial authorities have opened an investigation for rape into moroccan soccer player achraf hakimi, a source close to the investigation confirmed to cnn on tuesday.the nanterre prosecutor's office, just outside of paris, is leading the investigation, the source added.spanish-born moroccan hakimi is a full-back for paris saint-germain and plays for the moroccan national side. he scored the penalty kick that took morocco to the world cup semifinals during qatar 2022.""the nanterre prosecutor's office does not wish to comment on this ongoing investigation, as the information already published jeopardizes the inquiries necessary for finding the truth,"" the prosecutor's office told cnn.cnn has reached out to hakimi for comment.read more"
