,url,content
14,https://edition.cnn.com/2023/02/24/sport/boxing-olympics-chaos-iba-usa-spt-intl,"CNN —

It’s an Olympic sport which has its origins in Ancient Greece, and which helped stars of the ring such as Muhammad Ali, George Foreman, Joe Frazier, Nicola Adams, Claressa Shields and Katie Taylor become known to global audiences.

These days, however, Olympic boxing is on the ropes, bruised and battered by infighting.

USA Boxing accused the Russian-led International Boxing Association (IBA) on Monday of possible “sabotage,” saying the IBA had announced a “false and misleading” qualification process for the 2024 Olympic Games.

It comes after tension between the IBA and the International Olympic Committee (IOC) as well as several boxing federations around the world, which has led to eight countries, including the US, boycotting the forthcoming women’s and men’s world championships, according to Reuters.

How did Olympic boxing reach this tipping point and what is next for the sport with Paris 2024 a little over a year away?

Andy Cruz of Team Cuba dodges a punch from Keyshawn Davis of Team USA during the men's lightweight final at the Tokyo 2020 Olympics. Buda Mendes/Getty Images

A long road

Tensions started to emerge in 2019.

A report, sanctioned by the IOC, into the IBA’s running of the sport recommended that the IBA be suspended from its right to organize the boxing tournament at the 2020 Olympics because of the “ongoing seriousness of the issues in the areas of finance, governance, ethics, and refereeing and judging.”

Serbian IOC member Nenad Lalovic delivered the report to the IOC executive, saying the IBA could reach a debt of as much as 29 million Swiss francs ($31 million) by the end of June 2021.

At the time, IBA interim president Mohamed Moustahsane said it was imperative for the organization to “come together and work together as a unit” so it can “continue to fight for our Olympic future.”

The IOC voted unanimously to implement the recommendations. In a statement, the IOC President Thomas Bach said there needed to be “fundamental change” before the suspension could be lifted and that the Olympic governing body’s decision was “taken in the interest of the athletes and the sport of boxing.”

As a result of its exclusion from the qualification process and the official Tokyo Games, the IBA lost the right to run the qualifications for the Tokyo 2020 Games. An IOC task force ran the qualification for Tokyo 2020 as well as the Games themselves.

In June 2022, the IOC maintained the suspension, making public the roadmap the IBA would have to follow, including financial transparency and changing its refereeing and judging process, before the IOC could consider lifting the sanctions in 2023.

A particular concern for the IOC was the IBA’s “financial dependency” on Russian state-owned oil company Gazprom, according to the IOC. Gazprom has been sanctioned by both the UK and US governments.

Midway through 2022, the IOC announced the qualification process for the 2024 Games in Paris and said the competition itself would once again not be run by the IBA due to the “continuing and very concerning issues” over governance, refereeing, and the judging system.

In a statement the IBA said it had been “dealing with significant governance issues,” which it said were a “burden from the past leadership.”

“We continue to be punished for a culture of corruption that was created and nourished by some of the individuals from the IOC’s upper echelon,” the statement added.

“This culture of corruption was developed over time and fixing it will take time to be done right, which has been ongoing for more than 2 years.”

The IBA is headed by Russian Umar Kremlev after he was elected in December, 2020.

Kremlev was re-elected unopposed in May, 2022 after Dutch candidate Boris van der Vorst was declared ineligible. The Court of Arbitration for Sport ruled a month later that van der Vorst was wrongly prevented from standing.

IBA president Umar Kremlev speaks at a press conference ahead of the 2023 Women World Boxing Championship. Sonu Mehta/Hindustan Times/Getty Images

IBA makes surprise announcement

On Monday, the IBA said its upcoming women’s and men’s world championships in New Delhi in March and Tashkent in May will in fact be “main qualification events” for Paris 2024.

The IBA’s announcement came after eight major boxing nations, including the US and the UK, announced they would boycott the events due to the IBA allowing Russian and Belarusian fighters to compete with their national flags and anthems, according to Reuters.

Athletes from both countries have been barred from competing under their nation’s banners – or competing in general – in many sports following Russia’s invasion of Ukraine.

Belarus helped Russia launch its initial invasion of Ukraine last February, allowing the Kremlin’s troops to enter the country through the 1,000-kilometer (621-mile) Ukrainian-Belarusian border to the north of Kyiv.

Last year, the IBA announced it was permitting athletes from both Russia and Belarus to compete under their flags, at the time going against IOC guidelines which recommended that Russian and Belarusian athletes be banned from competition.

In January, 2023, the IOC outlined a multi-step plan for Russian and Belarusian athletes to participate at the upcoming 2024 Summer Games in Paris and the 2026 Winter Games in Milan as “neutral athletes.”

About a month later, the US and more than 30 other “like-minded” countries released a statement asking the IOC to reconsider its decision, and announced they were backing a proposed ban of Russian and Belarusian athletes from competing in international sports.

The countries – including the UK, Canada and most of Europe – said in a joint statement that there is “no practical reason to move away from the exclusion regime for Russian and Belarusian athletes.”

On Wednesday, the IOC reiterated its condemnation of the war in Ukraine, saying the “Olympic Movement remains steadfast in its commitment to help the Ukrainian athletes in every way possible.”

The IBA said it will offer support to any athlete from a boycotted nation to compete if they wish to and not fall foul of national federations choosing to “use geopolitics as a means to play political games within boxing.”

A series of regional qualification tournaments will provide the foundation of qualification for the Olympic Games next year after the system was approved by the IOC last September.

(Left to right) Silver medalist Pat McCormack, gold medalist Cuba's Roniel Iglesias and bronze medalists Russian Olympic Committee's Andrei Zamkovoi and Ireland's Aidan Walsh celebrate on the podium after the men's welterweight boxing final at the 2020 Olympics. Luis Robayo/AFP/Getty Images

There will also be two world qualification tournaments early next year to complete the process.

In a statement sent to CNN, the IOC contradicted the IBA’s announcement, saying “the IBA will not be involved in Paris 2024’s boxing qualifications and tournament.”

The statement said the IBA’s suspension was “still in force” and that “the only valid boxing qualification system for Paris 2024 is the one approved by the IOC EB in September 2022, published and distributed to NOCs and boxing National Federations on 6 December 2022.”

According to Reuters, boxing has yet to be confirmed for the 2028 Los Angeles Olympic Games, pending reforms demanded by the IOC.

USA Boxing reacts

In a statement on February 20, USA Boxing executive director, Mike McAtee, called the IBA’s announcement of qualifying tournaments “totally unacceptable” and said it “clearly intends to cause confusion in the United States and the world boxing community.”

“IBA is, at best, incompetent. At worst, USA Boxing believes this may be an attempt to sabotage the Olympic Qualification for Paris Olympic Games,” he said.

McAtee added that USA Boxing remained “committed to the Olympic movement” by following the IOC’s principles of “proper governance, promoting neutral third-party oversight of the field of play, condemning false and misleading information from IBA leadership and demanding transparent financial management.”

On Wednesday, Ukraine’s boxing federation (FBU) joined the other eight federations in boycotting the IBA’s world championships.

FBU vice president Oleg Ilchenko told public broadcaster Suspilne that Ukrainian atheltes will not participate in both the men’s and women’s championships.

“Our answer is clear – our athletes and representatives of the Boxing Federation of Ukraine do not compete where representatives of the aggressor countries, namely Russia and Belarus, will compete,” Ilchenko said, per Reuters.

Ilchenko added: “As long as the war is going on and as Russian troops are on the territory of our country … they will not participate.”"
15,https://edition.cnn.com/2023/02/20/sport/anderson-comas-gay-chicago-white-sox-spt-intl,"CNN —

Chicago White Sox Minor League baseball player Anderson Comas announced he is “proudly and happily part of the LGTBQ+ community,” in an Instagram post on Sunday.

“I’m also a human with a great soul, I’m respectful, I’m a lover, I love my family and friends and that’s what really matters, I enjoy my work a lot, being a professional baseball player is the best thing that happened to me so I just wanna say something to those people that says that gay people can not be someone in this life, well look at me I’m Gay and I’m a professional athlete so that didn’t stopped (sic) me to make my dreams come true,” Comas said.

Comas, 23, is a converted outfielder who now pitches. He spent last season in the White Sox single A team, the Kannapolis Cannon Ballers in North Carolina.

He warned that his Instagram post was not for everyone.

“If you’re homophobic this post may not (be) for you….so you can see we all matters and we all are the same…

“I’m doing this cause I wanna be an inspiration for those like me out there fitting for their dreams, please don’t listen to those stupid things that people say about us, fight for your dreams, believe in yourself and go for it,” he added.

Chris Getz, White Sox assistant general manager/player development, said the team was “proud” of Anderson and confirmed he “first shared his news with us last year,” in a Chicago White Sox tweet on Sunday.

“And I was very pleased that he was comfortable sharing with us in player development. I also was happy at the reaction across the organization, which as you would expect was to support, help and congratulate a teammate. With his social media post today, we are so proud of Anderson and that he is comfortable sharing such an important personal part of his life so openly,” Getz added.

Comas joins pitcher Solomon Bates, who came out as gay after being released in 2022 when he was a minor leaguer in the Giants organization, and former Brewers farmhand David Denson, who became the first openly gay active player in affiliated baseball in 2015."
16,https://edition.cnn.com/2023/03/07/football/liverpool-uefa-refund-champions-league-final-spt-intl,"CNN —

UEFA plans to refund all Liverpool supporters who had tickets for the 2022 Champions League Final in Paris, the governing body of European soccer announced on Tuesday.

Last year’s final was delayed by more than 35 minutes after Liverpool fans struggled to enter the Stade de France and tear gas was used by French police towards supporters held in tightly packed areas.

There was widespread criticism about the way fans were treated at the game, with UK Member of Parliament Ian Byrne – who was at the match as a Liverpool fan – describing the situation outside the stadium as “one of the most horrendous experiences of my life.”

A UEFA statement on the refund said: “UEFA will implement a special refund scheme for fans who were most affected when accessing the Stade de France on 28 May 2022.

“Refunds will be available to all fans with tickets for gates A, B, C, X, Y and Z where the most difficult circumstances were reported.

“Given these criteria, the special refund scheme covers all of the Liverpool FC ticket allocation for the Final, i.e. 19,618 tickets.”

UEFA noted that Real Madrid fans and neutral supporters affected while accessing the stadium can also claim refunds, depending on whether they meet the criteria.

Police patrol inside the Stade de France during the 2022 Champions League Final. Dylan Martinez/Reuters

An independent review commissioned by UEFA found that the organization bears “primary responsibility” for circumstances which almost caused the event to turn into a “mass fatality catastrophe.”

“We recognize the negative experiences of those supporters on the day and, with this scheme, we will refund fans who had bought tickets and who were the most affected by the difficulties in accessing the stadium,” UEFA General Secretary Theodore Theodoridis said.

“We have taken into account a huge number of views expressed both publicly and privately and we believe we have devised a scheme that is comprehensive and fair.

“We value the input from the Liverpool FC supporter organizations Spirit of Shankly (SOS) and Liverpool Disabled Supporters Association (LDSA) as well as the open and transparent dialogue throughout this period,” Theodoridis added.

Spirit of Shankly (SOS) issued a statement in conjunction with the Liverpool Disabled Supporters Society, reading: “We welcome today’s announcement from UEFA. This unprecedented move is the result of tireless work, alongside FSE (Football Supporters Europe) and Ian Byrne MP, to hold those responsible for the catastrophic events in Paris.

“With a promise to reimburse supporters, UEFA have gone some way to acknowledging their part in the fiasco. But it does not excuse UEFA, exempt them from criticism or lessen the need for them to implement all of the recommendations made by the independent inquiry.

“We will work alongside Liverpool and publish details once we know how and when refunds will be processed.”

In a statement on Tuesday, Tony Winterburn – a partner at Pogust Goodhead, the law firm running the case against UEFA on behalf of Liverpool fans who attended the Champions League final – said the refund scheme is insufficient compensation.

“Digesting the fine details of this scheme will allow us to determine if it is, in fact, ‘comprehensive and fair’. Although this does present as a step towards UEFA accepting responsibility for the events, our legal case is still progressing,” Winterburn said.

“It is pertinent the extent of the physical and psychological injuries of our clients remains at the forefront of this process.

“We believe the term ‘refund,’ in its broadest sense, does not go far enough in providing redress or acknowledging the true harm suffered by those at an event that should have been safe for all to attend.”"
17,https://edition.cnn.com/2023/03/07/sport/minnesota-vikings-kj-osborn-car-spt-intl,"CNN —

Minnesota Vikings’ star KJ Osborn says he and three other people helped save a man who was trapped inside a burning car in Austin, Texas, on Sunday.

“Most of the time the saying goes ‘wrong place wrong time.’ But this time I believe God had me, us, at the right place at the exact right time,” third-year wide receiver Osborn said in a Twitter post on Monday.

“Last night myself and these 3 absolute hero’s helped save a man’s life by rescuing him from a vehicle up in flames after a bad crash. A situation I’d never imagine being apart of in a million years.

“I’ll leave you with this. God is real. And His LOVE is real. He will send his angels to be camped around you and provide you with his grace and mercy.”

Osborn posted several photos of the disturbing scene. One showed a burning car with what appears to be a man aiding a person inside.

Another is a photo of the aftermath of the wrecked and scorched vehicle. And a third of himself, and the three other people who he says helped the man escape the burning wreck.

CNN has reached out to the Austin police department but did not immediately hear back.

Osborn of the Minnesota Vikings warms up before a game on November 7, 2021. Scott Taetsch/Getty Images

Osborn spoke about the incident on ESPN’s Adam Schefter’s podcast, saying: “I’m on my way home, I’m on the back of an Uber, and my head is down and I’m on my phone, just on my way home.

“My Uber driver just starts going crazy. He’s like, ‘Oh my gosh! Oh my gosh!’ I look up, and I’m wondering what’s all the fuss about and there’s nobody on the street.

“He’s like, ‘This guy crashed,’ and I look to my right and there’s a car, if you were to picture it, under a bridge’s pillars. His car is head-on. He hit the pillar and his car is in flames.”

The 25-year-old, who was chosen in the fifth round of the 2020 NFL Draft out of the University of Miami, said his Uber driver exited the car and insisted they call 911.

The driver then ran up to the car door, and Osborn followed. After initial hesitation, Osborn said he and the driver, with the help of two others on the scene, then pulled the man out the vehicle, picked him up and carried him to safety then waited with him until emergency medical services, firefighters and the police arrived.

Osborn, who is training in Austin, says he has been in contact with the man and intends to visit him at the hospital, together with the three others who helped save him. He added that he believes the man only suffered minor injuries.

“I’m just grateful that I was in the position to be able to help him as well as the three other heroes to be there.”

CNN reached out to the Vikings for comment from Osborn but did not immediately hear back."
