,url,content
0,https://edition.cnn.com/2023/03/06/football/world-cup-final-penalty-shootout-spt-intl,"CNN —

A soccer match lasts for 90 minutes, another 30 if there really needs to be a winner. But if it’s still level after that, then the game will be decided with a penalty shootout, arguably the most nerve-shredding experience in all of sports.

For the fans, it’s excruciating; at the World Cup in Qatar, one Argentina supporter sobbed uncontrollably as she watched the quarterfinal shootout against the Netherlands through her fingers. By the end, she looked distraught. All the emotion had been wrung out of her, and the tears that she cried were of relief, rather than joy.

For the players, such emotions are magnified tenfold. “Love hurts,” goes the anonymous quote, “but not as much as penalties.”

Success or failure could be career-defining, one simple kick from 12 yards is weighed down by teammates’ hopes and the expectation of potentially millions of fans. As the author Karl Wiggins put it, “It’s as if, for a few seconds, a player’s soul is laid bare for the entire world to see.”

Argentina supporters cheer during the World Cup final against France. Paul Ellis/AFP/Getty Images

Very few people would admit to enjoying a shootout, but Professor Geir Jordet is an exception; he can’t get enough of them.

“A penalty shootout is a very uncomfortable event,” he told CNN Sport from his research facility in Oslo. “It’s painful because the pressure is so intense, and of course, the consequences of failing are so dire. Penalties, for me, are wonderful!”

Professor Jordet works at the Norwegian School of Sport Sciences, where he specializes in performance under extreme pressure. He’s been studying shootouts for almost 20 years and has analyzed more than 200 of them, around 2,000 kicks in total.

He’s studied the psychology of the event, observed the behavior and dynamics of the participants and crunched the data to conclude that even the most dramatic of shootouts can be swayed by teams who know what they’re doing.

“The main factor in a penalty shootout is luck,” the former England goalkeeper Peter Shilton once declared, but Jordet is convinced that it is never “only a lottery.”

Aurelien Tchouameni misses France's third penalty in the World Cup final. Julian Finney/Getty Images

Penalties are more important than ever

The margin between success and failure in title matches seems to be getting slimmer, and so it’s in shootouts, where the margins are even tighter, that soccer’s biggest prizes are being decided.

“If you enter a major tournament today with the ambition to win,” says Jordet, “you’re making a severe mistake if you’re not prepared for penalties.”

In 2021, both the Brazilian men and the Canadian women needed penalty wins en route to Olympic gold in Tokyo; in the same month, Argentina survived a shootout to win the Copa América and Italy triumphed in the same way at the European Championship at Wembley.

Mohamed Salah had to endure laser pointers in the 2021 Africa Cup of Nations final penalty shootout. Backpage Media/Shutterstock

The following year was a bonanza for penalties.

Starting in February with Senegal’s Africa Cup of Nations final win against Egypt. Liverpool won two English cup finals – both against Chelsea – on spot-kicks, while Real Betis and RB Leipzig won the Spanish and German Cup finals respectively from the spot.

Eintracht Frankfurt beat Rangers in the Europa League final on penalties while the Philadelphia Union missed all of its kicks to hand LAFC the title after an extraordinary MLS Cup Final.

The 2022 penalty party concluded in Qatar where there was a record five shootouts, including the final.

Within seconds of the final whistle being blown, Jordet can tell if one side has the edge. He’s able to glean valuable information simply by observing the interactions on the field.

“The coach and the staff of some teams almost panic when the game goes to penalties,” Jordet explained to CNN Sport. “It seems like they don’t know what to do. And then with other teams, it’s all dealt with before the game and definitely before the penalties.”

Jurgen Klopp won plaudits for the way he managed two penalty shootout victories for Liverpool in the League and FA Cup finals. Michael Regan/The FA/Getty Images

Last season’s FA Cup final was a case in point; Jordet observed that Liverpool’s manager Jurgen Klopp had established a plan and communicated it calmly and warmly to each of his players within 90 seconds of the final whistle.

They spent the remaining time casually interacting and even laughing. Several more minutes had passed before Chelsea’s seemingly fraught manager Thomas Tuchel approached his players, and he was still revising his notes.

“He moves to the middle of the circle, BEFORE he’s done with the plan,” Jordet observed in a tweet thread, “Tuchel then asks his players about the shots, publicly in front of the whole team.

“There’s plenty of group pressure when done this way, the chance of honest responses from the players drops, and it creates further stress that carries on to the shootout itself.”

Liverpool’s efficient organization meant the players were able to take up a position within the center circle that was closest to their coaching staff, where Klopp continued to exude warmth and love.

Chelsea went on to miss two penalties and Liverpool claimed the trophy.

World Cup Final penalty masterclass

Nobody can influence the proceedings in a shootout more than the goalkeeper, who is involved in every single kick. Jordet’s research has confirmed that the goalies aren’t just there to stop the shots, they can be a positive influence on their teammates and a destructive force for their opponents.

In recent seasons, Argentina’s 30-year-old goalkeeper Emiliano Martínez has established himself as a gamechanger in shootouts, the “Machiavelli of football.”

Jordet has noticed that his psychological antics are a nightmare for his opponents. During the semifinal of the Copa América against Colombia in 2021, he intimidated his opponents with trash talk, saving three penalties in a 3-2 win.

Since the stadiums were empty of fans in that edition, Jordet has noted that you could clearly hear what he was saying, “I can tell you’re nervous. I know where you’re going to shoot. Watch and see how I’m going to eat you up. Remember, I’m going to eat you up!”

But it was in the World Cup final against France that Martínez demonstrated the full range of his expertise.

Jordet says that he set the tone right from the start, arriving first in the penalty area and claiming the territory as his own. “Martínez took a very proactive approach to everything,” Jordet explained.

“He created his home in the penalty area. He initiated some handshakes with the first French players to arrive,” a disarming strategy which makes opponents drop their guard and renders them more vulnerable when he later strikes.

Argentina fans played their part by pilling pressure on the French penalty takers. Simon Stacpoole/Offside/Getty Images

For the first two French penalties, Martínez discreetly set about disrupting the takers, urging the referee to check the placement of the ball on the spot.

This kind of interference would be unsettling for any penalty takers, but he was also feeling out the referee: how much would he be prepared to tolerate?

Jordet believes that enabled Martínez to quickly assume a proactive role within just two kicks and was then able to “fully get to work.”

Martínez saved the second penalty that he faced, diving low to his right to deny Kingsley Coman, and his celebration was exuberant.

Jordet notes that goalkeepers don’t typically celebrate so wildly, but his research has shown that celebrations can influence subsequent events.

“We found, to our astonishment, that penalty takers who celebrate intensely have a statistically higher probability of ending up on the winning team.

“In fact, the next penalty taker for the opponent misses about 10-15% of the time, and your next [teammate] scores about 7 to 8% more of their penalties. These types of celebratory displays are contagious.”

By the time the third French player stepped up, Martínez knew that he could get away with almost anything. He snatched up the ball, turned his back on the referee and walked back to his goal line.

The approaching Aurélien Tchouaméni should have arrived at the biggest moment of his professional career to find the ball on the spot, instead Martínez was holding it, gesturing to the Argentine fans to increase the volume.

France fans show their support for les bleus during the World Cup final. Catherine Ivill/Getty Images

When the referee demanded its return, Martínez rolled it away at a 45-degree angle, forcing Tchouaméni to fetch it himself. Jordet has calculated that whenever a player has to wait for a kick, the probability of a goal drops by 20 to 30%.

Tchouaméni aimed low and to the left and missed.

By now, Martínez knew that his own teammates could face similar tactics from the French goalie Hugo Lloris, so he grabbed the ball himself and handed it to his incoming teammate Leandro Paredes, one of four Argentine penalty takers, who all scored.

Martínez was eventually booked for interfering with the fourth French player, Randal Kolo Muani, but by then the damage was done and Argentina won the shootout 4-2.

“Very calculated, creative, well executed,” Jordet concludes, “but of course also highly, highly cynical.”

Emiliano Martínez of Argentina attempted to distract Randal Kolo Muani ahead of his penalty. Julian Finney/Getty Images

Martínez showed very little remorse for his “cynical” actions. After the final he said, “”I have no words for it. I was calm during the penalty shootout and everything went as we wanted.”

“All that I have dreamed of has been achieved.”

Since the conclusion of the World Cup, the International Football Association Board (IFAB), which determines the laws of football, confirmed to CNN Sport that it is looking to clarify what goalkeepers can and cannot do before penalties are taken.

This would include delaying the taking of the kick or touching the goalposts, crossbar or goal net.

Shootouts don’t always have to be so negative, though; sometimes, they can be won with love.

Jordet notes that when LAFC’s Cristian Tello missed the first penalty against Philadelphia in the MLS Cup Final, some of his teammates met him on his return to the center circle and walked him back in.

“You’re implicitly saying to the others that even if you miss, you’re a part of the group, which is the message that you would like to send to each other in a penalty shootout.”

Los Angeles made every other kick to claim the cup.

The power of intangibles

Some teams seem to revel in the cauldron of the shootout, while others dread it.

England has lost seven of the 10 that it’s participated in, while the Netherlands have lost seven out of eight. Spain’s loss to Morocco in 2022 means it’s now lost a record four shootouts in the FIFA World Cup alone.

Jordet has seen enough to believe in ghosts; he says that if your team has lost in a previous shootout, even if you weren’t involved in it, you’re more likely to miss. Conversely, success begets success.

Having lost to Czechoslovakia and the famous Antonin Panenka penalty in the European Championship final in 1976, Germany has won six in a row, Croatia has won its last four, and Argentina its last three, claiming both the Copa América and the World Cup.

More and more teams are coming to accept that understanding the psychology of shootouts is essential in the modern game, and 20 professional teams have already turned to Jordet’s consultancy business for help.

“I totally think there’s so much more to be discovered in the softer areas of sports science,” Jordet says, dismissing the cynics who claim that skill development, relationships and psychology are important, but not quantifiable.

“I honestly would beg to differ. If you know what to look for, you can measure a lot of these things in games, and this is something I work on every single day. I think we will make some big progress in the years to come.”

The Moroccan team gathered together for a prayer before going on to beat Spain in their penalty shootout. Julian Finney/Getty Images

Jordet knows so much about penalties because he spent years trawling the archives, watching every single shootout from the World Cup, European Championship and Copa América since 1976. He’s interviewed 25 players who were there and tested his predictions in practice with 15 elite teams.

“I love penalty shootouts,” he says, “I think it’s the ultimate drama in football.”

And yet, much of the nuance he described in the World Cup final wouldn’t have been obvious to the fans watching the game on TV because broadcasters tend to fill the space between the kicks with replays and closeups of anxious coaches and fans.

“The details that really mattered, the subplot of the event, can only be accessed if you’re lucky enough to have access to isolated broadcast cameras or by scrolling through fan videos on YouTube.

“TV producers aren’t always my friends,” Jordet concludes, “because they don’t look at what I like to look at.”

But now that teams are beginning to realize the value of small details in shootouts, perhaps broadcasters might also consider innovating their approach. The greatest drama in sport is happening right under their noses, and sometimes they’re missing the best bits."
1,https://edition.cnn.com/2023/03/07/sport/conor-benn-doping-analysis-reaction-spt-intl,"CNN —

Conor Benn’s scheduled fight with Chris Eubank Jr. last year was meant to be career defining for both men.

Except the fight never took place and now Benn says the fallout of its cancellation has raised serious questions about boxing’s drugs testing protocols.

The two were scheduled to take to their ring almost exactly 30 years after their fathers had in two fights that gripped a generation of boxing fans. Benn and Eubank Jr. were fighting for more than just glory. This was a fight for family honor.

But on the eve of the bout, news of Benn failing a drugs test came to light. The bout was called off after Benn tested positive for clomiphene, a fertility drug used by women who struggle to ovulate.

Benn repeatedly denied any wrongdoing and in February 2023, the World Boxing Council (WBC) issued a statement clearing Benn of wrongdoing, stating that while his urine test indicated the presence of prohibited substances, his “highly-elevated consumption of eggs” prior to testing offered a “reasonable explanation” for his failed test.

Despite welcoming the news that he could return to the sport, the 26-year-old Benn has criticized the investigation and expressed his concerns about the transparency of the process, in particular leveling criticism at the WBC and the British Boxing Board of Control (BBBofC), the governing body for professional boxing in Great Britain.

In a statement posted on his Instagram story last week, Benn said that “the manner in which I’ve been cleared has seemed to create further questions and add further fuel to baseless negative speculation.”

CNN has contacted the WBC and BBBofC for comment.

Cancellation

According to the U.S. Anti-Doping Agency (USADA), clomiphene in men can potentially boost testosterone levels “by interfering with the negative feedback loop of the hypothalamic-pituitary-gonadal axis.” The drug is also included on the World Anti-Doping Agency’s prohibited list under anti-estrogenic substances.

Benn began his statement on Instagram addressing the ruling saying that while he was “grateful for the ultimate finding” of being declared “innocent of being a drugs cheat,” he couldn’t sit by without commenting on the whole investigation.

“It was the right decision and it was the only one I was willing to accept. The easy option would have been to accept a six month ban, save myself a huge legal bill and simply move on, by my reputation and my family name is worth more to me than that,” he wrote.

“At no point did I indicate that I failed any VADA tests because of contaminated eggs,” Benn wrote, referring to the Voluntary Anti-Doping Association (VADA), a third-party testing agency used by the fighters to ensure a clean bout and which carried out his test.

“As part of its lengthy investigation, the WBC instructed its own experts to review my supplements and diet, and they concluded that egg contamination was the most likely cause,” he wrote, saying he provided a 270-page report to the body.

Benn added: “However, I feel like the WBC statement did a disservice to my defence, which was based upon a comprehensive scientific review of the testing procedures which set out a number of reasons why we believed the results were completely unreliable and proved beyond any reasonable doubt that I am innocent.”

Benn is still under investigation from UK Anti-Doping (UKAD) and the BBCofC at the time of publication.

He criticized the BBCofC’s handling of his case in his statement.

“As for the BBBoC, they attacked me publicly and privately during the most difficult time in my life, treating me with utter contempt and without any consideration for the fair process or my mental state.”

The BBCofC released their own statement on Twitter after the announcement from the WBC in February, saying that it was not “party to the review” and had not seen “any evidence provided on Mr. Benn’s behalf.”

It added that while “it respects the WBC, the WBC is a sanctioning body and not a governing body. The BBCofC was the governing body with whom Mr. Benn was licensed at the material time, and as such any alleged anti-doping violation shall be dealt with in accordance with its rules and regulations.”

It pointed to the UK Anti-Doping Rules, brought in by UKAD, which the BBCofC adheres to and that as a result, “the decision of the WBC does not affect the ongoing implantation of the BBCofC’s rules (and those of UKAD).”

CNN has contacted the BBCofC for comment. UKAD declined to comment when given the opportunity.

Benn punches Chris Algieri during their WBA Continental welterweight title fight on December 11, 2021. Alex Livesey/Getty Images

‘Serious concerns’

The WBC’s February ruling stated that they had found there to be “no failures in the procedures” in relation to Benn’s sample and test.

But Benn said he thought there was a lack of transparency throughout the whole investigation, claiming that his sample tested negative three times, but “without explanation” was tested nine days later which resulted in the positive test.

According to Benn, he asked for his B sample from the drug test – which the World Anti-Doping Agency says “affords the athlete the opportunity to have second analysis performed in the event their A sample returns” a positive test – to be tested as soon as possible.

Benn also said in his statement that he has been advised to take his case to the Court of Arbitration for Sport.

Benn said that he had never previously tested positive for a banned substance before October’s test, adding to his belief that the result was a “testing error.”

While Benn now says that he had to concentrate on “rebuilding” his career, the process he has gone through has given him “serious concerns about the whole testing system” in boxing.

“Anti-doping protections are obviously extremely important, but so is ensuring people are given due proves and presumed innocent until proven guilty. Cheaters should be caught and punished, but people like me who prove their innocent should be vindicated and allowed to continue their career.”

Benn admitted that he’d had suicidal thoughts as a result of the whole process, saying: “I didn’t think I’d see another day.”

“It’s hurt me,” Benn said in an interview with Piers Morgan on TalkTV. “I didn’t think I was going to make it through this period. I didn’t think I was going to make it through.”

When asked if he had felt suicidal, Benn replied: “Yeah. Yeah, I’d say so – and it upsets me now because I don’t know how I got so bad. I got in a really bad way about it.

“I was shamed for something I hadn’t even done. … If I had done something wrong, I’m human. I’d raise my hands to it, ‘I made a mistake,’ whatever it is, I raise my hands. Never this.

“I felt seven years of hard work and sacrifice, and leaving my family and the image I maintain, was just ruined by somebody else’s incompetence. It’s been hard for the family.”

Background

At the time of Benn’s positive test last year, the bout’s promoter, Matchroom, and that organization’s boss, Eddie Hearn, had been keen for the bout to go ahead despite it being “prohibited” by the BBBofC.

Hearn told the BBC at the time: “As we stand right now, the BBBofC is not sanctioning the fight. That does not mean the fight is off, but there is a process we have to go through.

“Conor Benn is not suspended, he is free and clear to fight. There’s lots going on with the lawyers.”

Eddie Hearn, boxing promoter of Matchroom boxing, speaks at the press conference ahead of Benn's scheduled fight with Eubank Jr. Alex Broadway/Getty Images

Amid mounting public pressure and safety concerns, the fight was canceled.

The decision to overlook potential safety concerns and stage a bout including a fighter who had tested positive for a banned substance prompted criticism that boxing prioritizes the fight’s money-making opportunities rather than the boxers’ safety.

Weeks later, the BBBofC claimed that Benn voluntarily relinquished his license with the governing body just before allegations of misconduct against Benn were upheld.

Benn accused the BBBofC of conducting an “unfair and biased procedure.” He also disputes that he relinquished his license.

“(Benn) strongly refutes the allegation of misconduct (which for the avoidance of doubt is not in relation to the Vada issue) and firmly believes that an independent tribunal will reach a wholly different conclusion,” a statement said on Benn’s Twitter at the time.

And a few months later, the WBC announced after it had conducted an investigation into the matter that Benn would be included in its ratings once again after it found that he had not “engaged in intentional or knowing ingestion of clomiphene.”"
2,https://edition.cnn.com/2023/03/06/sport/nfl-calvin-ridley-gambling-reinstated-spt,"CNN —

Jacksonville Jaguars wide receiver Calvin Ridley has been reinstated after he was suspended indefinitely after gambling on NFL games during the 2021 season as a member of the Atlanta Falcons, the league said Monday.

“Ridley, who had been suspended indefinitely since March 2022 for violating the NFL’s gambling policy, is eligible to participate in all team activities, effective immediately,” officials said.

Ridley, 28, said the suspension was self-inflicted and “an isolated lapse in judgment.”

“I have always owned my mistakes and this is no different,” Ridley said in a statement. “I have great respect for the game and am excited for the opportunity to restart my career in Jacksonville. I look forward to showing my new coaches, teammates, and the entire Jaguars organization exactly who I am and what I represent as a player and person.”

Ridley’s last NFL game was October 24, 2021, after which he stepped away from football to focus on his mental health.

The Jaguars, who are scheduled to hold their first workouts of the offseason next month, welcomed the NFL’s decision.

“We look forward to building a relationship with Calvin as both an individual and as a player. Calvin is a proven playmaker and we are excited to see him compete among and with his new teammates, first during our Offseason Program in April and ultimately into the 2023 season, as we collectively pursue a championship for Jacksonville.”

Jacksonville was 9-8 last season and made the playoffs as the No. 4 seed in the AFC.

In 2022, the league said the gambling allegedly took place during a five-day period in late November 2021 while Ridley was not with the team and was away from the club’s facility on the non-football illness list.

The former Alabama standout tweeted that he “bet 1500 total” but added, “I don’t have a gambling problem.”

Subsequent tweets included him saying, “I know I was wrong But I’m getting 1 year lol” and “If you know me you know my character.”

The NFL’s investigation found no evidence that any game was compromised in any way by Ridley’s actions.

Ridley won two national championships during his time at the University of Alabama and was a first-round draft pick for the Falcons in 2018. He had 248 receptions and 28 touchdowns in 49 games in Atlanta, according to NFL.com. In 2020, he was a second team All-Pro selection.

The Falcons traded Ridley in November 2022 to the Jaguars in exchange for draft picks."
