,url,content
9,https://edition.cnn.com/2023/02/27/football/super-league-documentary-football-jeff-zimbalist-spt-intl,"CNN —

Betrayal has formed part of European politics since polities started forming – just ask Julius Caesar, who asked “Et tu Brute?” as his friend stabbed him for the good of the Roman Republic.

Fast forward to April 2021 and the machinations behind the proposed European Super League (ESL) that would have turned the sport on its head, effectively discarding its flagship competition – the Champions League – are akin to a ‘House of Cards’ plot.

Driven by 12 of Europe’s biggest clubs, the ESL intended to break away from European soccer governing body’s UEFA to create their own competition containing 20 teams – the founding members as well as three other permanent unnamed clubs and five others who would qualify every year.

In the Apple TV+ documentary “Super League: The War for Football,” the decisions that led to the controversial proposal are presented as a “political thriller … 96 sleepless hours over the course of four days,” its Emmy-award winning director Jeff Zimbalist tells CNN Sports.

Featuring almost all the key decision makers, the documentary depicts fans who felt betrayed by their clubs, soccer betraying its principles – or its future – and, most stingingly of all, “betrayal” between friends.

The friendship between UEFA President Aleksander Čeferin and Andrea Agnelli, then Juventus chairman and European Club Association chairman, forms the main narrative and emotional thread of the documentary.

Initially so close that Agnelli named Čeferin his daughter’s godfather as they worked together on reforming European football, their friendship unraveled as it became clear that Agnelli had helped formulate the rival ESL and was “sort of the general of the opposing army,” Zimbalist says.

“The dynamics at play here aren’t that different from the emotional and relational dynamics that we all have in our lives every day,” he adds. “The complexity of who to trust. And how deep the wound of betrayal runs.”

Aleksander Čeferin was elected UEFA President in 2016. Apple TV+

Characters – normally seen as names in a press release or faces giving television interviews – are fleshed out and offer tangible reasons for their actions, delving into their backstories.

Čeferin speaks about the moral dilemmas he faced as a lawyer defending traffickers and murderers; Agnelli about his brother’s death; Real Madrid President Florentino Pérez’s about his love of the club; and Paris Saint-Germain President Nasser Al-Khelaifi’s about his tennis playing days.

“This is not a bunch of robotic, mechanical strategists sitting around a war room,” Zimbalist says. “These are human beings, flesh and blood, with three dimensions who are feeling all sorts of emotion during this time.

“We were watching what’s usually taking place behind closed doors unfolding in public, this battle that revealed to us the machinations of power and how they clash up against each other.”

‘Is it social democracy or is it capitalist utopia?’

But the reverberations of the proposed ESL were felt beyond personal relationships, beyond even soccer, as the project entangled Russian oligarchs, American hedge fund billionaires and Middle Eastern sheikhs – all of whom owned the clubs involved.

Even Prince William intervened, expressing his opposition to the idea, while then British Prime Minister Boris Johnson threatened to “drop a legislative bomb” to prevent the breakaway league forming.

Public opinion became another battleground, with UEFA decisively winning the PR war as the ESL plans were dismantled by fans, governments and other clubs within 48 hours of becoming public.

Andrea Agnelli was replaced by Nasser Al-Khelaifi as the chairman of the European Club Association. Apple TV+

The documentary is balanced, offering the ESL architects’ reasoning and plans in extensive interviews, assembling almost the entire cast of characters to face off once more in the court of public opinion.

“That was how we presented it to them,” Zimbalist says.

“We’re going to hopefully have audiences in a tug of war where they, for 15 minutes at a time, are rooting for UEFA and the fans and the next 15 minutes they’re rooting for the Super League because they can identify with the personal experiences of the architects on either side and they understand the arguments.”

But Zimbalist was wary of casting the ESL as a battle between only two sides, constantly reminding himself and his team of the other groups.

“You can very easily just look at UEFA vs. the architects of the Super League,” he says. “But then you’re leaving out, in some ways, the most important voice, which is the fan voice.”

The entire documentary opens with the fans, lingering on the emotion provoked by football, and detailing the sport’s most fairytale-like stories such as unfancied Leicester City winning the Premier League in 2016.

So much of football’s magic, almost every commentator and fan interviewed for the documentary says, comes from the drama of promotion and relegation which the ESL would have undermined.

Real Madrid won the 2022 Champions League. Mustafa Yalcin/Anadolu Agency/Getty Images

It epitomizes the ideal that a club can rise from the lowest to the highest ranks of the sport; an idea that has been battered recently by the consolidation of wealth among the top few clubs, owned by mega-rich owners and able to simply buy the best players.

“This identity crisis in the sport – is it social democracy or is it capitalist utopia?” Zimbalist says. “If you look at the Super League story, capitalism may have its hands around the throat of the sport, but it hasn’t fully appropriated the sport either because the fans came out victorious.”

European governing body UEFA too emerged victorious, vowing to stop the “cynical project,” as seemingly, did football’s world governing body FIFA which threatened to expel clubs from international competitions.

The documentary, however, details FIFA’s more ambiguous position, its own financial competition with UEFA and its talks engaging with the nascent league, the documentary says.

‘The war for football rages on’

Still the conditions that led to the proposed ESL continue to plague European football as its organizers unveiled a reformed competition with “60 to 80 teams” earlier this month.

Zimbalist’s documentary delves deep into these themes, explaining the origins of the wage inflation first driven by “old money” clubs such as Real Madrid and Manchester United which are now in turn outspent by “new money” club such as PSG and Manchester City.

“We wanted to use this saga as a lens through which to understand the inner workings of a $40 billion a year industry,” he says.

“And ask big questions about can culture be owned? And how do you govern culture?”

Giorgio Marchetti is the Deputy General Secretary of UEFA. Apple TV+

For Barcelona and Juventus, their financial situations have only become more desperate during the last two years.

Juventus was docked 15 points earlier this month following an investigation into the Turin-based team’s representation of their player sales between 2018 and 2020, while the entire board of directors – including Agnelli – resigned in November amid an investigation from the public prosecutor’s office in Turin.

Barcelona’s already precarious financial situation has worsened following two consecutive group stage exits in the Champions League, and its president said in January that the ESL will become “a reality in 2025.”

But Arsenal CEO Vinai Venkatesham told CNN’s Richard Quest last month that for them, “the Super League is in the past.”

“It was something that we apologized for and … going forward, it’s not something that we’re interested in.”

Meanwhile court cases arbitrating the league’s fallout rumble on.

An opinion issued by the European Court of Justice (ECJ) ruled in December that the measures FIFA and UEFA took to block the breakaway league were in line with European Union competition laws, a blow to the continuing proponents of the ESL.

The ECJ will issue its final judgement later this year.

The ESL in the incarnation that it was originally proposed seems unlikely to become a reality but the “ideas behind the Super League, the vision that it proposes, are likely to take other forms and to evolve,” Zimbalist says.

“Maybe the battle of this version of the Super League and is perhaps close to over. But the war for football rages on.”"
10,https://edition.cnn.com/2023/02/27/tennis/novak-djokovic-steffi-graf-record-tennis-spt-intl,"CNN —

Novak Djokovic has achieved another milestone in his illustrious tennis career, surpassing Steffi Graf to spend the most weeks at No. 1 in the world.

On Monday, Djokovic started his 378th week as the Association of Tennis Professionals (ATP) world No. 1, spending the most weeks in that spot since the ATP ranking system began in 1973.

A week ago, Djokovic matched the Women’s Tennis Association (WTA) leader, Graf, who held the top spot for 377 weeks in her career.

“With your love and great strength that you have given me over the years, I’ve managed to achieve many fantastic achievements throughout my career,” Djokovic said in a video message to fans, shared by the ATP.

“The most recent one breaking the record of 378 weeks on No. 1 rankings, surpassing one of the greatest, most legendary tennis players – both men and women – that ever played, Steffi Graf. So I’m flattered, obviously extremely, extremely proud and happy for this achievement.”

Djokovic jumped back up to No. 1 when he won the Australian Open last month. It was his 22nd major title, tying him with Rafael Nadal for the most grand slam singles titles in men’s tennis.

The 35-year-old will return to the court this week as the top seed in the Dubai Tennis Championships, his first tournament since the Australian Open.

The Serb has been out of action with a hamstring injury but told reporters he has been “pain free” for a week heading into his first match against the Czech Republic’s Tomás Machác on Tuesday.

It’s yet to be seen where and when Djokovic will play after Dubai, with his participation at next month’s Indian Wells and Miami Open tournaments in doubt.

The United States still requires international visitors to be vaccinated against Covid-19, and Djokovic, who has previously confirmed that he remains unvaccinated, has now applied for special permission to enter the country ahead of both tournaments, which start on March 6 and March 20 respectively.

“All I can do is hope at the moment because, you know, my position stays the same. There’s not much else I can do except wish for a positive result,” Djokovic previously told reporters."
11,https://edition.cnn.com/2023/02/28/football/fifa-best-awards-lionel-messi-alexia-putellas-spt-intl,"CNN —

Lionel Messi and Alexia Putellas were crowned the best players in men’s and women’s football at FIFA’s annual awards ceremony in Paris on Monday.

Messi, who guided Argentina to World Cup glory at the end of last year, was honored as the Best FIFA Men’s Player for the second time in the award’s current format, while Spanish midfielder Putellas was named Best FIFA Women’s Player for the second year running.

National team coaches and captains, as well as a worldwide panel of journalists and supporters, vote on the awards each year.

The 35-year-old Messi finished ahead of Paris Saint-Germain teammate Kylian Mbappé and Real Madrid forward Karim Benzema in the voting for the men’s award.

“I achieved a dream I had been hoping for so long,” said Messi, reflecting on Argentina’s World Cup win. “It’s a dream for any player, very few people can achieve that and I was lucky enough to do so.”

In the World Cup final, Messi scored twice as Argentina and France played out a thrilling 3-3 draw after extra time before Argentina triumphed on penalties.

Messi also scored six goals in 26 appearances as his PSG team won a record-equaling 10th title in Ligue 1.

In his voting capacity as Argentina’s captain, Messi chose PSG teammate Neymar as the best men’s player ahead of Mbappé and Benzema.

Putellas, meanwhile, scored 34 goals in all competitions last season and captained Barcelona to a domestic treble and a spot in the Champions League final against eventual winner Lyon.

Putellas collects the award for the Best FIFA Women's Player. Franck Fife/AFP/Getty Images

The 29-year-old, who missed the European Championships with an ACL injury, finished ahead of the USA international Alex Morgan and England striker Beth Mead in the voting.

She also becomes the first player to win the women’s award twice.

As well as Messi, two other Argentinians – goalkeeper Emiliano Martinez and coach Lionel Scaloni – were honored at the awards ceremony, while England goalkeeper Mary Earps and coach Sarina Wiegman were recognized on the women’s side.

The Puskás Award for the best goal in men’s and women’s football went to Polish amputee star Marcin Oleksy for an outrageous scissor-kick goal while playing for Warta Poznan in November.

“I connected really cleanly. It was pure,” Oleksy said about his goal.

“When I hit it, I was following the ball all the way with my eyes and I saw it go into the corner of the net. I always wanted to score a beautiful goal. You could see how proud it made me after I scored. I stood up tall, I put my chest out. I was just so, so happy.”"
12,https://edition.cnn.com/2023/03/08/tennis/novak-djokovic-ron-desantis-miami-open-intl-spt,"CNN —

Time might have run out for Novak Djokovic to be admitted US entry to play at Indian Wells, but US politicians – notably Florida Gov. Ron DeSantis – are lobbying for regulations to change and allow the world No. 1 into the country in time for the Miami Open.

The US still requires international visitors to be vaccinated against Covid-19, and the Serbian, who has previously said he remains unvaccinated, confirmed he had applied for special permission to enter the country ahead of both tournaments.

However, Indian Wells organizers announced on Sunday that Djokovic had withdrawn from the tournament, where main draw play began Wednesday.

DeSantis said he would “run a boat from the Bahamas” for Djokovic to compete in the Miami Open tennis tournament later this month.

“I would run a boat from the Bahamas here for him. I would do that a hundred percent,” DeSantis said at a press conference in Tampa Wednesday.

“I think his people are looking at it, and I’m not sure that’s the way they want to come into the country, which I understand. I think it’d be a great moment, but you know, nevertheless.”

According to the US Centers for Disease Control and Prevention Director, proof of Covid-19 vaccination is required for non-U.S. citizens, non-immigrant passengers arriving from a foreign country to the US by air, though that applies to other forms of travel.

On Tuesday, DeSantis had called on US President Joe Biden to intervene and allow Djokovic to compete in the tournament.

“The only thing keeping Novak Djokovic from participating in the Miami Open tennis tournament is President Biden’s misguided and unscientific COVID-19 vaccination requirement for foreigner travelers,” DeSantis, who has separately vowed to permanently ban mandates related to coronavirus mitigation as he considers a presidential bid, said on Twitter.

“Mr. President – lift your restrictions and let him compete,” he added.

Australian Open champion Novak Djokovic poses with the trophy. Carl Recine/Reuters

Republican Senators Rick Scott and Marco Rubio of Florida also urged the US president to allow Djokovic into the country to play.

“On a question of regarding the vaccination requirement, I refer you to the CDC – are the ones who deal with that,” White House press secretary Karine Jean-Pierre said Wednesday.

The vaccine requirement, she said, “is still in place, and we expect everyone to abide by our country’s rule, whether as a participant or spectator.”

US Open organizers said on Friday that they and the United States Tennis Association were “hopeful” that Djokovic was successful in his petition.

“Novak Djokovic is one of the greatest tennis players of all time and a six-time champion of the Miami Open,” the Miami Open said on Twitter on Friday.

“We hope he is allowed entry into the country so Floridians have the opportunity to see him compete once again.”

CNN has reached out to representatives for Djokovic and the U.S. Department of Homeland Security for comment.

“Look, last year I did miss both Indian Wells, Miami and all the US Open swing,” the 22-time grand slam winner Djokovic told reporters in Belgrade last month.

“So it wouldn’t be the first time if it does happen. I mean, I hope it doesn’t, but that’s all I can do. All I can do is hope at the moment because, you know, my position stays the same. There’s not much else I can do except wish for a positive result,” he said.

Djokovic returned to the world No. 1 position when he defeated Stefanos Tsitsipas to win a record 10th Australian Open in January.

It was his 22nd major title, which tied him with Rafael Nadal for the most grand slam singles titles in men’s tennis history.

The Miami Open’s main draw play starts March 22 and and the tournament nds April 2."
13,https://edition.cnn.com/2023/03/08/sport/ja-morant-memphis-grizzzlies-gun-lakers-loss-spt-intl,"CNN —

Facing three injuries, the Memphis Grizzlies have taken another player off their court. But this time, it’s due to police and NBA investigations into the team’s star player.

The Grizzlies lost their second straight game Tuesday without star guard Ja Morant, who is under investigation after the 23-year-old posted an Instagram Live video of himself Saturday appearing to hold a gun at a nightclub outside of Denver.

Morant has apologized for his actions via his representation on Saturday, after Memphis announced he would be away from the team.

Morant said he would take time away “to get help and work on learning better methods of dealing with stress and my overall well-being.”

Memphis head coach Taylor Jenkins said Sunday there is no timetable for Morant’s return. The team tweeted Wednesday that Morant will miss at least four more games, meaning he will return no earlier than March 17.

Morant is averaging 27.1 points per game in his fourth NBA season.

The Instagram video, posted early Saturday morning and shared widely on social media, shows Morant briefly flashing what appears to be a gun while listening to music at a nightclub.

The police department in Glendale, Colorado, a suburb of Denver, said Wednesday the agency won’t recommend charges against Morant.

“(The department) was not able to determine that probable cause existed for the filing of any charges. In this case, it should be noted that on the night in question (police) did not receive any calls for service at the nightclub regarding a weapon of any type,” department officials said in a statement.

No one made a complaint and investigators concluded no one was threatened or menaced with a gun, police said.

The league is also investigating the two-time All-Star point guard and the video, an NBA spokesperson told CNN.

Video Ad Feedback 'Most exciting young star' away from NBA court after gun controversy 02:04 - Source: CNN

It’s unknown why Morant was carrying a gun or if it was his. The Grizzlies played in Houston against the Rockets on March 1 before heading to Denver for a game against the Nuggets on March 3.

If Morant did bring the gun onto team facilities – which also includes the team plane – he is subject to NBA discipline according to its Collective Bargaining Agreement (CBA).

The CBA states that players are prohibited from carrying firearms while “physically present at a facility or venue owned, operated, or being used by a Team, the NBA, or any League-related entity, and whenever a player is traveling on any NBA-related business, whether on behalf of the player’s Team, the NBA, or any League-related entity”

If a player is in violation of the ruling in the CBA, they could face a fine and/or a suspension.

“The Commissioner shall have the power to suspend for a definite or indefinite period, or to impose a fine not exceeding $50,000, or inflict both such suspension and fine upon any person who, in his opinion, shall have been guilty of conduct prejudicial or detrimental to the Association,” the CBA reads.

While it is unclear what punishment Morant could face, the most recent example of a gun-related incident came in the 2009/10 season when Gilbert Arenas, a three-time All-Star, was suspended until the end of the season – 50 games – for bringing unloaded guns into his team’s locker room, and making light of the incident once he was punished.

Arenas pleaded guilty but avoided jail time and was sentenced to two years of supervised probation, was embroiled in a dispute with teammate Javaris Crittenton – who was also suspended the rest of the season for the incident – over money in a poker game.

The US government said at the time that Arenas brought at least one firearm into the Washington Wizards’ locker room.

Arenas would later return to the Wizards, while Crittenton was released by Washington after his suspension, playing two more years of professional basketball before being charged with murder in August 2011. In April 2015, Crittenton plead guilty to voluntary manslaughter with a weapon and aggravated assault with a firearm and was sentenced to 23 years in prison.

Meanwhile, the Grizzlies are not having a great time of it on the court. Their 112-103 defeat by the Los Angeles Lakers at the Crypto.com Arena in LA on Tuesday came two days after losing in the same building to the Los Angeles Clippers.

Lakers forward Troy Brown Jr. is fouled by Desmond Bane of the Grizzlies as he attempts a layup. Harry How/Getty Images

Jaren Jackson Jr. led the way for the Grizzlies, finishing with 26 points, but it wasn’t enough as a dominant Anthony Davis – who racked up 30 points and 22 rebounds – and 17 points each for Dennis Schröder, Rui Hachimura and Austin Reaves led the surging Lakers to a seventh win in 10 games as they attempt to make the playoffs.

Still, the Grizzlies sit third in the Western Conference with a 38-26 record."
